"StranaNr","Pořadí","Jméno","Věk","Povolání","Bydliště","Obhajuje","Příslušnost","Minulá kandidatura"
803,1,"JAN KRÁLÍK",44,"strojník-ledař","Ocmanice","Ne","BEZPP",""
805,1,"MARIE BOJANOVSKÁ",66,"důchodce","Ocmanice","Ano","BEZPP","MARIE BOJANOVSKÁ, NEZÁVISLÝ KANDIDÁT"
802,1,"BOŽENA BUREŠOVÁ",40,"účetní","Ocmanice","Ano","BEZPP","BOŽENA BUREŠOVÁ, NEZÁVISLÝ KANDIDÁT"
807,1,"MILOSLAV NETRDA",49,"tesař","Ocmanice","Ano","BEZPP","MILOSLAV NETRDA, NEZÁVISLÝ KANDIDÁT"
806,1,"MARTA RYBNÍČKOVÁ",65,"důchodce","Ocmanice","Ano","BEZPP","MARTA RYBNÍČKOVÁ, NEZÁVISLÝ KANDIDÁT"
808,1,"VĚRA FILIPČÍKOVÁ",54,"účetní","Ocmanice","Ano","BEZPP","VĚRA FILIPČÍKOVÁ, NEZÁVISLÝ KANDIDÁT"
804,1,"LUDMILA JANEČKOVÁ",39,"dělnice","Ocmanice","Ne","BEZPP",""
801,1,"ZDENĚK NETRDA",31,"traktorista","Ocmanice","Ne","BEZPP",""
809,1,"ZDENĚK ČÍHAL",42,"JE Dukovany izolatér","Ocmanice","Ano","BEZPP","ZDENĚK ČÍHAL, NEZÁVISLÝ KANDIDÁT"
