"StranaNr","Pořadí","Jméno","Věk","Povolání","Bydliště","Obhajuje","Příslušnost","Minulá kandidatura"
802,1,"VÁCLAVA VLACHOVÁ",42,"vedoucí laboratoře","Chmelná","Ne","BEZPP",""
805,1,"LADISLAV KAMARÝT",25,"student","Chmelná","Ano","BEZPP","LADISLAV KAMARÝT, NEZÁVISLÝ KANDIDÁT"
808,1,"PAVEL FILIP",34,"pracovník THP","Chmelná","Ano","BEZPP","PAVEL FILIP, NEZÁVISLÝ KANDIDÁT"
801,1,"TOMÁŠ LHOTKA",36,"vývojový pracovník","Chmelná","Ano","BEZPP","TOMÁŠ LHOTKA, NEZÁVISLÝ KANDIDÁT"
807,1,"PETR FILIP",36,"OSVČ","Chmelná","Ano","BEZPP","PETR FILIP, NEZÁVISLÝ KANDIDÁT"
803,1,"TOMÁŠ MARTÍNEK",43,"OSVČ","Chmelná","Ano","BEZPP","TOMÁŠ MARTÍNEK, NEZÁVISLÝ KANDIDÁT"
804,1,"TOMÁŠ KUČERA",37,"truhlář","Chmelná","Ano","BEZPP","TOMÁŠ KUČERA, NEZÁVISLÝ KANDIDÁT"
806,1,"PAVEL NOVÁK",38,"OSVČ","Chmelná","Ne","BEZPP",""
