"StranaNr","Pořadí","Jméno","Věk","Povolání","Bydliště","Obhajuje","Příslušnost","Minulá kandidatura"
808,1,"OLGA EDEROVÁ",38,"zubní technik","Čelistná","Ne","BEZPP","OLGA EDEROVÁ, NEZÁVISLÝ KANDIDÁT"
805,1,"LUBOŠ ŘÍMAL",38,"řidič","Čelistná","Ano","BEZPP","LUBOŠ ŘÍMAL, NEZÁVISLÝ KANDIDÁT"
809,1,"MARTIN VLK",32,"hasič","Čelistná","Ne","BEZPP",""
802,1,"PETR JOZÍFEK",49,"operátor silomistr ZZN","Čelistná","Ne","BEZPP",""
801,1,"Mgr. JIŘÍ BARTOŠKA",42,"učitel","Čelistná","Ano","BEZPP","JIŘÍ BARTOŠKA, NEZÁVISLÝ KANDIDÁT"
807,1,"KVĚTA HRONOVÁ",53,"kuchařka","Čelistná","Ano","BEZPP","KVĚTA HRONOVÁ, NEZÁVISLÝ KANDIDÁT"
804,1,"LUBOŠ KUMŽÁK",42,"OSVČ","Čelistná","Ano","BEZPP","LUBOŠ KUMŽÁK, NEZÁVISLÝ KANDIDÁT"
806,1,"ZDENĚK VÁŇA",34,"OSVČ","Čelistná","Ano","BEZPP","ZDENĚK VÁŇA, NEZÁVISLÝ KANDIDÁT"
803,1,"VLASTA KLAPOVÁ",59,"účetní OÚ","Čelistná","Ano","BEZPP","VLASTA KLAPOVÁ, NEZÁVISLÝ KANDIDÁT"
