"StranaNr","Pořadí","Jméno","Věk","Povolání","Bydliště","Obhajuje","Minulá kandidatura","Změnil stranu"
801,1,"FRANTIŠEK SEMRÁD",62,"technik","Katov","Ne","FRANTIŠEK SEMRÁD, NEZÁVISLÝ KANDIDÁT",""
804,1,"MARCELA DVOŘÁKOVÁ",37,"OSVČ","Katov","Ano","MARCELA DVOŘÁKOVÁ, NEZÁVISLÝ KANDIDÁT",""
805,1,"JIŘÍ VOJTA",62,"dělník","Katov","Ano","JIŘÍ VOJTA, NEZÁVISLÝ KANDIDÁT",""
803,1,"JAROSLAVA ŠVEJDOVÁ",58,"vedoucí školní jídelny","Katov","Ano","JAROSLAVA ŠVEJDOVÁ, NEZÁVISLÝ KANDIDÁT",""
807,1,"JAN VYHLÍDKA",64,"důchodce","Katov","Ano","JAN VYHLÍDKA, NEZÁVISLÝ KANDIDÁT",""
809,1,"JIŘÍ NOVÁK",35,"OSVČ","Katov","Ano","JIŘÍ NOVÁK, NEZÁVISLÝ KANDIDÁT",""
806,1,"MILAN PŘIBYL",34,"projektant","Katov","Ano","MILAN PŘIBYL, NEZÁVISLÝ KANDIDÁT",""
808,1,"KAREL MLEZIVA",66,"důchodce","Katov","Ne","",""
802,1,"MICHAL JUNEK",32,"regionální manažer","Katov","Ne","",""
