"StranaNr","Pořadí","Jméno","Věk","Povolání","Bydliště","Obhajuje","Příslušnost","Minulá kandidatura"
802,1,"ALENA ČECHOVÁ",41,"OSVČ","Sedlec","Ano","BEZPP","ALENA ČECHOVÁ, NEZÁVISLÝ KANDIDÁT"
806,1,"MVDr. JAN KOŽÍŠEK",57,"MVDr.","Sedlec","Ano","BEZPP","JAN KOŽÍŠEK, NEZÁVISLÝ KANDIDÁT"
804,1,"BLANKA KNEDLHANSOVÁ",22,"dělnice","Sedlec","Ne","BEZPP",""
809,1,"MARTIN ŘENČ",40,"OSVČ","Sedlec","Ano","BEZPP","MARTIN ŘENČ, NEZÁVISLÝ KANDIDÁT"
808,1,"MARKÉTA ŘENČOVÁ",39,"OSVČ","Sedlec","Ne","BEZPP","MARKÉTA ŘENČOVÁ, NEZÁVISLÝ KANDIDÁT"
803,1,"ROMAN DVOŘÁČEK",44,"instalatér","Sedlec","Ano","BEZPP","ROMAN DVOŘÁČEK, NEZÁVISLÝ KANDIDÁT"
801,1,"PETR ČECH",40,"OSVČ","Sedlec","Ne","BEZPP",""
805,1,"VÁCLAV KNEDLHANS",55,"údržbář","Sedlec","Ano","BEZPP","VÁCLAV KNEDLHANS, NEZÁVISLÝ KANDIDÁT"
807,1,"KAREL ŠILHAN",68,"důchodce","Sedlec","Ne","BEZPP",""
