"StranaNr","Pořadí","Jméno","Věk","Povolání","Bydliště","Obhajuje","Minulá kandidatura","Změnil stranu"
805,1,"JIŘÍ ZAHRADNÍK",43,"řidič","Brambory","Ano","JIŘÍ ZAHRADNÍK, NEZÁVISLÝ KANDIDÁT",""
802,1,"PAVEL ŠOLTA",36,"podnikatel","Brambory","Ne","PAVEL ŠOLTA,ML. NEZÁVISLÝ KANDIDÁT",""
808,1,"Ing. MIROSLAV ŠTOČEK",54,"ekonom","Brambory","Ano","MIROSLAV ŠTOČEK, NEZÁVISLÝ KANDIDÁT",""
807,1,"JIŘÍ STRÁNSKÝ",40,"zahradník","Brambory","Ano","JIŘÍ STRÁNSKÝ, NEZÁVISLÝ KANDIDÁT",""
804,1,"JOSEF SEMERÁD",59,"automechanik","Brambory","Ano","JOSEF SEMERÁD, NEZÁVISLÝ KANDIDÁT",""
806,1,"RADEK TOMAN",41,"technik","Brambory","Ano","RADEK TOMAN, NEZÁVISLÝ KANDIDÁT",""
809,1,"MARTIN SKAČAN",31,"řidič","Brambory","Ano","MARTIN SKAČAN, NEZÁVISLÝ KANDIDÁT",""
801,1,"LENKA ŠVEHLÍKOVÁ",50,"logistička","Brambory","Ne","",""
803,1,"PAVEL ANDRLÍK",36,"řidič","Brambory","Ne","",""
