"StranaNr","Pořadí","Jméno","Věk","Povolání","Bydliště","Obhajuje","Minulá kandidatura","Změnil stranu"
802,1,"Mgr. JAN PAVEL",39,"učitel","Bernardov","Ano","NEZÁVISLÝ KANDIDÁT JAN PAVEL",""
803,1,"ZDENĚK KREJČÍK",35,"zaměstnanec","Bernardov","Ano","NEZÁVISLÝ KANDIDÁT ZDENĚK KREJČÍK",""
801,1,"JAROSLAV VÁŠA",57,"ošetřovatel skotu","Bernardov","Ano","NEZÁVISLÝ KANDIDÁT JAROSLAV VÁŠA",""
806,1,"HELENA DAŇKOVÁ",59,"důchodce","Bernardov","Ne","",""
805,1,"LUBOMÍR KOUDELKA",46,"operátor mechanik","Bernardov","Ne","",""
804,1,"MILAN ROHLÍČEK",23,"pracovník v potravinářské výrobě","Bernardov","Ne","",""
