"StranaNr","Pořadí","Jméno","Věk","Povolání","Bydliště","Obhajuje","Příslušnost","Minulá kandidatura"
801,1,"JAROSLAV VÁŠA",57,"ošetřovatel skotu","Bernardov","Ano","BEZPP","NEZÁVISLÝ KANDIDÁT JAROSLAV VÁŠA"
802,1,"Mgr. JAN PAVEL",39,"učitel","Bernardov","Ano","BEZPP","NEZÁVISLÝ KANDIDÁT JAN PAVEL"
805,1,"LUBOMÍR KOUDELKA",46,"operátor mechanik","Bernardov","Ne","BEZPP",""
806,1,"HELENA DAŇKOVÁ",59,"důchodce","Bernardov","Ne","BEZPP",""
804,1,"MILAN ROHLÍČEK",23,"pracovník v potravinářské výrobě","Bernardov","Ne","BEZPP",""
803,1,"ZDENĚK KREJČÍK",35,"zaměstnanec","Bernardov","Ano","BEZPP","NEZÁVISLÝ KANDIDÁT ZDENĚK KREJČÍK"
