"StranaNr","Pořadí","Jméno","Věk","Povolání","Bydliště","Obhajuje","Minulá kandidatura","Změnil stranu"
805,1,"JAROSLAV KUNÁŠEK",34,"projektový manažer","Hraběšín","Ano","JAROSLAV KUNÁŠEK, NEZÁVISLÝ KANDIDÁT",""
806,1,"MILOSLAV KODEŠ",36,"invalidní důchodce","Hraběšín","Ne","MILOSLAV KODEŠ, NEZÁVISLÝ KANDIDÁT",""
801,1,"HANA STRNADELOVÁ",52,"ošetřovatelka","Hraběšín","Ano","HANA STRNADELOVÁ, NEZÁVISLÝ KANDIDÁT",""
803,1,"JIŘÍ GRÁD",35,"poříčný","Hraběšín","Ano","JIŘÍ GRÁD, NEZÁVISLÝ KANDIDÁT",""
804,1,"VÁCLAV HOSPODKA",39,"dělník","Hraběšín","Ano","VÁCLAV HOSPODKA, NEZÁVISLÝ KANDIDÁT",""
802,1,"ILONA OLIVOVÁ",43,"skladník","Hraběšín","Ano","ILONA OLIVOVÁ, NEZÁVISLÝ KANDIDÁT",""
807,1,"JIŘÍ MALÝ",48,"automechanik-elektrikář","Hraběšín","Ano","JIŘÍ MALÝ, NEZÁVISLÝ KANDIDÁT",""
808,1,"KATEŘINA ROZKOŠNÁ",31,"mateřská dovolená","Hraběšín","Ne","",""
