"StranaNr","Pořadí","Jméno","Věk","Povolání","Bydliště","Obhajuje","Příslušnost","Minulá kandidatura"
901,6,"Ing. JITKA KRÁLOVÁ",35,"bankovní úřednice","Horní Kněžeklady","Ne","BEZPP",""
901,4,"ANNA JINDROVÁ",64,"důchodce","Horní Kněžeklady","Ano","BEZPP","ANNA JINDROVÁ, NEZÁVISLÝ KANDIDÁT"
901,1,"JOSEF DRN",53,"technik","Štipoklasy","Ano","BEZPP","JOSEF DRN, NEZÁVISLÝ KANDIDÁT"
7,1,"HANA ČIPEROVÁ",65,"důchodkyně","Dolní Kněžeklady","Ano","BEZPP","ČESKÁ STRANA SOCIÁLNĚ DEMOKRATICKÁ"
7,2,"PETR HAJÍČEK",61,"skladník","Dolní Kněžeklady","Ano","BEZPP","ČESKÁ STRANA SOCIÁLNĚ DEMOKRATICKÁ"
901,5,"JAN FILIP",63,"důchodce","Horní Kněžeklady","Ano","BEZPP","JAN FILIP, NEZÁVISLÝ KANDIDÁT"
901,3,"JOSEF NOVOTNÝ",49,"opravář","Štipoklasy","Ano","BEZPP","JOSEF NOVOTNÝ, NEZÁVISLÝ KANDIDÁT"
901,7,"PETR RŮŽIČKA",26,"záchranář","Dolní Kněžeklady","Ne","BEZPP",""
901,2,"RŮŽENA JINDROVÁ",65,"důchodce","Dolní Kněžeklady","Ano","BEZPP","RŮŽENA JINDROVÁ, NEZÁVISLÝ KANDIDÁT"
