"StranaNr","Pořadí","Jméno","Věk","Povolání","Bydliště","Obhajuje","Příslušnost","Minulá kandidatura"
805,1,"HANA HAVLASOVÁ",51,"OSVČ","Třešovice","Ne","BEZPP","HANA HAVLASOVÁ, NEZÁVISLÝ KANDIDÁT"
807,1,"JANA VOHRYZKOVÁ",36,"OSVČ","Třešovice","Ano","BEZPP","JANA VOHRYZKOVÁ, NEZÁVISLÝ KANDIDÁT"
809,1,"JOSEF KLOUD",62,"řidič","Třešovice","Ano","BEZPP","JOSEF KLOUD, NEZÁVISLÝ KANDIDÁT"
804,1,"LIBOR PRŮCHA",43,"truhlář","Třešovice","Ne","BEZPP","LIBOR PRŮCHA, NEZÁVISLÝ KANDIDÁT"
808,1,"OLGA TURKOVÁ",44,"pokojská","Třešovice","Ne","BEZPP","OLGA TURKOVÁ, NEZÁVISLÝ KANDIDÁT"
802,1,"KLÁRA BARTOŠOVÁ",21,"dělnice","Třešovice","Ne","BEZPP",""
806,1,"JAROSLAVA KAPUSTOVÁ",57,"dělnice","Třešovice","Ne","BEZPP",""
803,1,"VÁCLAV TUREK",51,"stavbyvedoucí","Třešovice","Ano","BEZPP","VÁCLAV TUREK, NEZÁVISLÝ KANDIDÁT"
801,1,"VLADIMÍR TUREK",50,"mistr elektrikářů","Třešovice","Ano","BEZPP","VLADIMÍR TUREK, NEZÁVISLÝ KANDIDÁT"
