"StranaNr","Pořadí","Jméno","Věk","Povolání","Bydliště","Obhajuje","Minulá kandidatura","Změnil stranu"
802,1,"MIROSLAV DOČKAL",44,"invalidní důchodce","Drslavice","Ano","MIROSLAV DOČKAL, NEZÁVISLÝ KANDIDÁT",""
808,1,"JITKA SÝKOROVÁ",49,"prodavačka","Trpín","Ano","JITKA SÝKOROVÁ, NEZÁVISLÝ KANDIDÁT",""
809,1,"Mgr. HANA PATRASOVÁ",38,"učitelka","Drslavice","Ano","MGR. HANA PATRASOVÁ, NEZÁVISLÝ KANDIDÁT",""
803,1,"LUKÁŠ DUBOVSKÝ",31,"OSVČ","Drslavice","Ne","LUKÁŠ DUBOVSKÝ, NEZÁVISLÝ KANDIDÁT",""
805,1,"JANA SMOLÍKOVÁ",30,"mateřská dovolená","Chválov","Ano","JANA SMOLÍKOVÁ, NEZÁVISLÝ KANDIDÁT",""
801,1,"Bc. MIROSLAVA BINDEROVÁ",41,"účetní","Drslavice","Ano","MIROSLAVA BINDEROVÁ, NEZÁVISLÝ KANDIDÁT",""
804,1,"PETR MACHOVEC",38,"OSVČ","Švihov","Ne","",""
806,1,"PETR DOMÍN",40,"OSVČ","Drslavice","Ne","",""
807,1,"ZDENĚK ŠVEJDA",56,"OSVČ","Drslavice","Ne","",""
