"StranaNr","Pořadí","Jméno","Věk","Povolání","Bydliště","Obhajuje","Minulá kandidatura","Změnil stranu"
804,1,"MIROSLAV ŠNEJDAR",41,"specialista technologie CAD/CAM","Všechlapy","Ano","MIROSLAV ŠNEJDAR, NEZÁVISLÝ KANDIDÁT",""
803,1,"VÁCLAV VÁVRA",57,"seřizovač","Všechlapy","Ano","VÁCLAV VÁVRA, NEZÁVISLÝ KANDIDÁT",""
802,1,"RADEK ROZVORAL",47,"podnikatel","Všechlapy","Ano","RADEK ROZVORAL, NEZÁVISLÝ KANDIDÁT",""
806,1,"MICHAELA VESELÁ",40,"porodní asistentka","Všechlapy","Ano","MICHAELA VESELÁ, NEZÁVISLÝ KANDIDÁT",""
805,1,"HELENA VAŇKOVÁ",55,"podnikatel","Všechlapy","Ano","HELENA VAŇKOVÁ, NEZÁVISLÝ KANDIDÁT",""
808,1,"JOSEF PROCHÁZKA",58,"technik","Všechlapy","Ano","JOSEF PROCHÁZKA, NEZÁVISLÝ KANDIDÁT",""
801,1,"JAN PIVKO",32,"instalatér","Všechlapy","Ne","",""
807,1,"MILAN KOŠVANEC",33,"obchodní manažer","Všechlapy","Ne","",""
