"StranaNr","Pořadí","Jméno","Věk","Povolání","Bydliště","Obhajuje","Minulá kandidatura","Změnil stranu"
806,1,"Ing. IVAN KRAUS",51,"úředník","Nová Ves","Ano","IVAN KRAUS, NEZÁVISLÝ KANDIDÁT",""
801,1,"MIROSLAV SEDLÁK",58,"státní zaměstnanec","Nová Ves","Ano","MIROSLAV SEDLÁK, NEZÁVISLÝ KANDIDÁT",""
802,1,"FRANTIŠEK ZACHATÝ",71,"důchodce","Nová Ves","Ano","FRANTIŠEK ZACHATÝ, NEZÁVISLÝ KANDIDÁT",""
807,1,"LUBOŠ MARTÍNEK",52,"technik","Nová Ves","Ano","LUBOŠ MARTÍNEK, NEZÁVISLÝ KANDIDÁT",""
805,1,"MICHAL NEDVĚD",50,"státní zaměstnanec","Nová Ves","Ano","MICHAL NEDVĚD, NEZÁVISLÝ KANDIDÁT",""
803,1,"ALEŠ DRNEC",36,"technik","Nová Ves","Ano","ALEŠ DRNEC, NEZÁVISLÝ KANDIDÁT",""
804,1,"JIŘÍ DRNEC",41,"autoklempíř","Nová Ves","Ano","JIŘÍ DRNEC, NEZÁVISLÝ KANDIDÁT",""
