"StranaNr","Pořadí","Jméno","Věk","Povolání","Bydliště","Obhajuje","Příslušnost","Minulá kandidatura"
7,1,"Ing. VÁCLAV HLAVATÝ",52,"OSVČ","Vrchovnice","Ano","ČSSD","SDRUŽENÍ NEZÁVISLÝCH KANDIDÁTŮ ""PRO ROZVOJ OBCE"""
901,3,"Ing. STANISLAV ŠTĚRBA",49,"soukromý zemědělec","Vrchovnice","Ano","BEZPP","ING. STANISLAV ŠTĚRBA, NEZÁVISLÝ KANDIDÁT"
901,2,"LUBOŠ SLÁDEK",49,"elektro mechanik","Vrchovnice","Ne","BEZPP",""
901,1,"PAVEL LHOTSKÝ",57,"invalidní důchodce","Vrchovnice","Ano","BEZPP","PAVEL LHOTSKÝ, NEZÁVISLÝ KANDIDÁT"
901,4,"Mgr. VÁCLAV ZUBR",53,"lékárník","Vrchovnice","Ano","BEZPP","MGR. VÁCLAV ZUBR, NEZÁVISLÝ KANDIDÁT"
