"StranaNr","Pořadí","Jméno","Věk","Povolání","Bydliště","Obhajuje","Minulá kandidatura","Změnil stranu"
802,1,"VÁCLAV PRŮŠA",35,"projektový manažer","Jilem","Ne","OBČANSKÁ DEMOKRATICKÁ STRANA","*"
805,1,"LADISLAV KLEMENT",46,"skladník","Jilem","Ano","LADISLAV KLEMENT, NEZÁVISLÝ KANDIDÁT",""
803,1,"RICHARD SMETÁČEK",59,"dělník","Jilem","Ano","RICHARD SMETÁČEK, NEZÁVISLÝ KANDIDÁT",""
801,1,"JAROMÍR RASOCHA",49,"dělník","Jilem","Ano","JAROMÍR RASOCHA, NEZÁVISLÝ KANDIDÁT",""
804,1,"VÁCLAV ŠIŠKA",63,"důchodce","Jilem","Ano","VÁCLAV ŠIŠKA, NEZÁVISLÝ KANDIDÁT",""
807,1,"KAREL HOSPODKA",34,"zemědělec","Jilem","Ano","KAREL HOSPODKA, NEZÁVISLÝ KANDIDÁT",""
809,1,"MILAN KLEMENT",52,"technik","Jilem","Ano","MILAN KLEMENT, NEZÁVISLÝ KANDIDÁT",""
808,1,"RADEK KUBÁT",44,"řidič","Jilem","Ano","RADEK KUBÁT, NEZÁVISLÝ KANDIDÁT",""
806,1,"KAREL PETR",37,"řidič","Jilem","Ne","",""
