"StranaNr","Pořadí","Jméno","Věk","Povolání","Bydliště","Obhajuje","Příslušnost","Minulá kandidatura"
808,1,"LADISLAV LEBEDA",22,"student","Kunemil","Ne","BEZPP",""
809,1,"JAROSLAV MRKVIČKA",26,"konstruktér","Kunemil","Ano","BEZPP","JAROSLAV MRKVIČKA, NEZÁVISLÝ KANDIDÁT"
801,1,"JAROSLAV MYŠIČKA",63,"důchodce","Kunemil","Ano","BEZPP","JAROSLAV MYŠIČKA, NEZÁVISLÝ KANDIDÁT"
802,1,"MARTIN PRONĚK",21,"student","Kunemil","Ne","BEZPP",""
806,1,"JIŘÍ VESELSKÝ",32,"ředitel společnosti","Kunemil","Ano","BEZPP","JIŘÍ VESELSKÝ, NEZÁVISLÝ KANDIDÁT"
805,1,"PAVEL HROCH",30,"skladník","Kunemil","Ne","BEZPP",""
803,1,"PAVEL PRONĚK",48,"konstruktér","Kunemil","Ano","BEZPP","PAVEL PRONĚK, NEZÁVISLÝ KANDIDÁT"
804,1,"LUKÁŠ VLČEK",27,"OSVČ","Kunemil","Ano","BEZPP","LUKÁŠ VLČEK, NEZÁVISLÝ KANDIDÁT"
807,1,"PAVEL PEJCHAR",48,"konstruktér","Kunemil","Ano","BEZPP","PAVEL PEJCHAR, NEZÁVISLÝ KANDIDÁT"
