"StranaNr","Pořadí","Jméno","Věk","Povolání","Bydliště","Obhajuje","Příslušnost","Minulá kandidatura"
806,1,"JAN VANÍČEK",47,"vedoucí střediska","Kostelec","Ano","BEZPP","JAN VANÍČEK, NEZÁVISLÝ KANDIDÁT"
804,1,"LUKÁŠ VELART",39,"programátor","Kostelec","Ano","BEZPP","LUKÁŠ VELART, NEZÁVISLÝ KANDIDÁT"
801,1,"JAROSLAV KRÁTKÝ",42,"strojní mechanik","Kostelec","Ano","BEZPP","JAROSLAV KRÁTKÝ, NEZÁVISLÝ KANDIDÁT"
803,1,"MARIE HARTMANOVÁ",62,"důchodce","Kostelec","Ano","BEZPP","MARIE HARTMANOVÁ, NEZÁVISLÝ KANDIDÁT"
805,1,"MILOSLAV BUBÁK",52,"technolog","Kostelec","Ne","BEZPP",""
807,1,"MARKÉTA KRÁTKÁ",45,"učitelka MŠ","Kostelec","Ano","BEZPP","MARKÉTA KRÁTKÁ, NEZÁVISLÝ KANDIDÁT"
802,1,"VLASTIMIL HARTMAN",39,"svářeč","Kostelec","Ano","BEZPP","VLASTIMIL HARTMAN, NEZÁVISLÝ KANDIDÁT"
