"StranaNr","Pořadí","Jméno","Věk","Povolání","Bydliště","Obhajuje","Příslušnost","Minulá kandidatura"
809,1,"JOSEF MAREŠ",49,"řidič","Věžná","Ano","BEZPP","JOSEF MAREŠ, NEZÁVISLÝ KANDIDÁT"
803,1,"Ing. PAVEL MARTINEC",36,"středoškolský učitel","Věžná","Ano","BEZPP","PAVEL MARTINEC, NEZÁVISLÝ KANDIDÁT"
805,1,"JAN ZÍKA",54,"instalatér","Věžná","Ne","BEZPP",""
806,1,"MARTIN SVADBA",25,"řidič","Věžná","Ne","BEZPP",""
808,1,"JIŘÍ KOTRBA",39,"řidič","Věžná","Ano","BEZPP","JIŘÍ KOTRBA, NEZÁVISLÝ KANDIDÁT"
807,1,"LADISLAV VLACH",51,"technik","Věžná","Ano","BEZPP","LADISLAV VLACH, NEZÁVISLÝ KANDIDÁT"
804,1,"JIŘÍ DUŠEK",44,"OSVČ","Brná","Ne","BEZPP",""
802,1,"TOMÁŠ KERTIS",38,"OSVČ","Věžná","Ano","BEZPP","TOMÁŠ KERTIS, NEZÁVISLÝ KANDIDÁT"
801,1,"MIROSLAV ZÍKA",47,"řidič","Věžná","Ano","BEZPP","MIROSLAV ZÍKA, NEZÁVISLÝ KANDIDÁT"
