"StranaNr","Pořadí","Jméno","Věk","Povolání","Bydliště","Obhajuje","Minulá kandidatura","Změnil stranu"
807,1,"RICHARD KOŠKA",43,"podnikatel","Zahrádka","Ano","RICHARD KOŠKA, NEZÁVISLÝ KANDIDÁT",""
808,1,"Ing. VÁCLAV ŽÁK",47,"podnikatel","Kostelec nad Vltavou","Ano","ING. VÁCLAV ŽÁK, NEZÁVISLÝ KANDIDÁT",""
805,1,"LUBOŠ KUBEŠ",49,"traktorista","Kostelec nad Vltavou","Ano","LUBOŠ KUBEŠ, NEZÁVISLÝ KANDIDÁT",""
801,1,"MILOŠ MAŠEK",23,"servisní mechanik","Přílepov","Ne","MILOŠ MAŠEK, NEZÁVISLÝ KANDIDÁT",""
802,1,"Ing. KAREL CHALUPNÝ",60,"obchodní zástupce","Kostelec nad Vltavou","Ano","KAREL CHALUPNÝ, NEZÁVISLÝ KANDIDÁT",""
803,1,"PAVEL KOSÍK",56,"úředník","Kostelec nad Vltavou","Ano","PAVEL KOSÍK, NEZÁVISLÝ KANDIDÁT",""
809,1,"MIROSLAV RŮŽIČKA",52,"podnikatel","Kostelec nad Vltavou","Ano","MIROSLAV RŮŽIČKA, NEZÁVISLÝ KANDIDÁT",""
804,1,"VÁCLAV PTÁČEK",40,"revírník LČR","Kostelec nad Vltavou","Ano","VÁCLAV PTÁČEK, NEZÁVISLÝ KANDIDÁT",""
806,1,"PETR KŘÍŽ",35,"policista","Kostelec nad Vltavou","Ano","PETR KŘÍŽ, NEZÁVISLÝ KANDIDÁT",""
