"StranaNr","Pořadí","Jméno","Věk","Povolání","Bydliště","Obhajuje","Minulá kandidatura","Změnil stranu"
805,1,"ZDENĚK HUSPEK",67,"důchodce","Loučim","Ano","ZDENĚK HUSPEK, NEZÁVISLÝ KANDIDÁT",""
807,1,"Ing. JANA DIRRIGLOVÁ",43,"projektový manažer","Loučim","Ano","JANA DIRRIGLOVÁ, NEZÁVISLÝ KANDIDÁT",""
801,1,"MILAN ZIMMERMANN",51,"instalatér","Loučim","Ano","MILAN ZIMMERMANN, NEZÁVISLÝ KANDIDÁT",""
803,1,"RICHARD HONKA",44,"technik","Loučim","Ano","RICHARD HONKA, NEZÁVISLÝ KANDIDÁT",""
804,1,"MICHAL ČIHÁK",36,"kuchař","Loučim","Ne","MICHAL ČIHÁK, NEZÁVISLÝ KANDIDÁT",""
802,1,"KAREL HALADA",29,"řidič","Loučim","Ano","KAREL HALADA, NEZÁVISLÝ KANDIDÁT",""
808,1,"JOSEF ŠVÁB",49,"zedník","Loučim","Ano","JOSEF ŠVÁB, NEZÁVISLÝ KANDIDÁT",""
806,1,"MILAN JUNG",44,"technik","Loučim","Ano","MILAN JUNG, NEZÁVISLÝ KANDIDÁT",""
