"StranaNr","Pořadí","Jméno","Věk","Povolání","Bydliště","Obhajuje","Příslušnost","Minulá kandidatura"
802,1,"KAREL HALADA",29,"řidič","Loučim","Ano","BEZPP","KAREL HALADA, NEZÁVISLÝ KANDIDÁT"
806,1,"MILAN JUNG",44,"technik","Loučim","Ano","BEZPP","MILAN JUNG, NEZÁVISLÝ KANDIDÁT"
804,1,"MICHAL ČIHÁK",36,"kuchař","Loučim","Ne","BEZPP","MICHAL ČIHÁK, NEZÁVISLÝ KANDIDÁT"
805,1,"ZDENĚK HUSPEK",67,"důchodce","Loučim","Ano","BEZPP","ZDENĚK HUSPEK, NEZÁVISLÝ KANDIDÁT"
808,1,"JOSEF ŠVÁB",49,"zedník","Loučim","Ano","BEZPP","JOSEF ŠVÁB, NEZÁVISLÝ KANDIDÁT"
807,1,"Ing. JANA DIRRIGLOVÁ",43,"projektový manažer","Loučim","Ano","BEZPP","JANA DIRRIGLOVÁ, NEZÁVISLÝ KANDIDÁT"
803,1,"RICHARD HONKA",44,"technik","Loučim","Ano","BEZPP","RICHARD HONKA, NEZÁVISLÝ KANDIDÁT"
801,1,"MILAN ZIMMERMANN",51,"instalatér","Loučim","Ano","BEZPP","MILAN ZIMMERMANN, NEZÁVISLÝ KANDIDÁT"
