"StranaNr","Pořadí","Jméno","Věk","Povolání","Bydliště","Obhajuje","Minulá kandidatura","Změnil stranu"
806,1,"MIROSLAV HORÁČEK",57,"pracovník čerpací stanice","Nevolice","Ano","MIROSLAV HORÁČEK, NEZÁVISLÝ KANDIDÁT",""
804,1,"ANNA ČADKOVÁ",43,"referentka NSD","Nevolice","Ano","ANNA ČADKOVÁ, NEZÁVISLÝ KANDIDÁT",""
808,1,"ANNA CICHÁ",52,"úřednice","Nevolice","Ano","ANNA CICHÁ, NEZÁVISLÝ KANDIDÁT",""
803,1,"MARIE KONÁŠOVÁ",52,"osobní bankéř","Nevolice","Ano","MARIE KONÁŠOVÁ, NEZÁVISLÝ KANDIDÁT",""
805,1,"MARTIN ŠKUTA",46,"svářeč","Nevolice","Ano","MARTIN ŠKUTA, NEZÁVISLÝ KANDIDÁT",""
802,1,"JOSEF VELEK",51,"ošetřovatel dojnic","Nevolice","Ano","JOSEF VELEK, NEZÁVISLÝ KANDIDÁT",""
807,1,"MICHAL JANSA",46,"mistr","Nevolice","Ne","",""
801,1,"VĚRA HÖTZELOVÁ",41,"ošetřovatelka skotu","Nevolice","Ne","",""
