"StranaNr","Pořadí","Jméno","Věk","Povolání","Bydliště","Obhajuje","Příslušnost","Minulá kandidatura"
801,1,"Ing. MILOSLAV PITRO",58,"technik","Mokrosuky","Ne","ČSSD",""
806,1,"JAROSLAV KOLÁŘ",60,"opravář zemědělských strojů","Mokrosuky","Ano","BEZPP","JAROSLAV KOLÁŘ, NEZÁVISLÝ KANDIDÁT"
808,1,"JAROSLAV POTUŽÁK",57,"OSVČ","Lešišov","Ne","BEZPP",""
805,1,"VÁCLAV LEVÝ",66,"důchodce","Mokrosuky","Ano","BEZPP","VÁCLAV LEVÝ, NEZÁVISLÝ KANDIDÁT"
809,1,"ZDENĚK PITEL",40,"OSVČ","Mokrosuky","Ano","BEZPP","ZDENĚK PITEL, NEZÁVISLÝ KANDIDÁT"
807,1,"JAN VOJTA",40,"řidič","Mokrosuky","Ano","BEZPP","JAN VOJTA, NEZÁVISLÝ KANDIDÁT"
802,1,"Ing. VÁCLAV MATĚJKA",50,"OSVČ","Mokrosuky","Ano","BEZPP","VÁCLAV MATĚJKA, NEZÁVISLÝ KANDIDÁT"
803,1,"VÁCLAV FREMUND",37,"řidič","Mokrosuky","Ano","BEZPP","VÁCLAV FREMUND, NEZÁVISLÝ KANDIDÁT"
804,1,"ZDENĚK NĚMEC",39,"řidič","Mokrosuky","Ano","BEZPP","ZDENĚK NĚMEC, NEZÁVISLÝ KANDIDÁT"
