"StranaNr","Pořadí","Jméno","Věk","Povolání","Bydliště","Obhajuje","Příslušnost","Minulá kandidatura"
901,5,"PAVEL ŠNITA",36,"soukromý zemědělec","Polesí","Ne","BEZPP",""
901,6,"MARTIN KOTT",24,"OSVČ","Polesí","Ne","BEZPP",""
901,3,"JIŘÍ LISA",56,"OSVČ","Polesí","Ano","BEZPP","JIŘÍ LISA, NEZÁVISLÝ KANDIDÁT"
901,2,"Ing. MIROSLAV HANZÁLEK",57,"stavbyvedoucí","Polesí","Ano","BEZPP","MIROSLAV HANZÁLEK, NEZÁVISLÝ KANDIDÁT"
901,1,"JUDr. JOSEF VACHEK",61,"soukr. podnikatel","Polesí","Ano","BEZPP","JOSEF VACHEK, NEZÁVISLÝ KANDIDÁT"
901,4,"ZDENKA HANZÁLKOVÁ",63,"důchodce","Polesí","Ano","BEZPP","ZDENKA HANZÁLKOVÁ, NEZÁVISLÝ KANDIDÁT"
