"StranaNr","Pořadí","Jméno","Věk","Povolání","Bydliště","Obhajuje","Příslušnost","Minulá kandidatura"
801,1,"BOHUSLAV PECH",52,"soukromý podnikatel","Proseč pod Křemešníkem","Ano","BEZPP","BOHUSLAV PECH, NEZÁVISLÝ KANDIDÁT"
807,1,"JIŘÍ BARTOŠKA",67,"důchodce","Proseč pod Křemešníkem","Ano","BEZPP","JIŘÍ BARTOŠKA, NEZÁVISLÝ KANDIDÁT"
805,1,"ILONA BUŘIČOVÁ",47,"celní deklarantka","Proseč pod Křemešníkem","Ano","BEZPP","ILONA BUŘIČOVÁ, NEZÁVISLÝ KANDIDÁT"
804,1,"MARTIN ROD",41,"logistik","Proseč pod Křemešníkem","Ano","BEZPP","MARTIN ROD, NEZÁVISLÝ KANDIDÁT"
803,1,"VLADIMÍR BRÁVEK",55,"soukromý podnikatel","Proseč pod Křemešníkem","Ano","BEZPP","VLADIMÍR BRÁVEK, NEZÁVISLÝ KANDIDÁT"
809,1,"LUKÁŠ VÁLEK",33,"na rodičovské dovolené","Proseč pod Křemešníkem","Ne","BEZPP",""
802,1,"PAVEL BRÁVEK",40,"soukromý podnikatel","Proseč pod Křemešníkem","Ano","BEZPP","PAVEL BRÁVEK, NEZÁVISLÝ KANDIDÁT"
806,1,"ZDENĚK HRNČÍŘ",39,"soukromý podnikatel","Proseč pod Křemešníkem","Ano","BEZPP","ZDENĚK HRNČÍŘ, NEZÁVISLÝ KANDIDÁT"
808,1,"MIROSLAV RÁSOCHA",44,"vedoucí střediska","Proseč pod Křemešníkem","Ne","BEZPP",""
