"StranaNr","Pořadí","Jméno","Věk","Povolání","Bydliště","Obhajuje","Minulá kandidatura","Změnil stranu"
805,1,"LUDĚK VOLF",43,"řidič","Balkova Lhota","Ano","LUDĚK VOLF, NEZÁVISLÝ KANDIDÁT",""
801,1,"JAROSLAV MAYER",38,"mechanik","Balkova Lhota","Ano","JAROSLAV MAYER, NEZÁVISLÝ KANDIDÁT",""
803,1,"STANISLAV ŠIKA",44,"automechanik","Balkova Lhota","Ano","STANISLAV ŠIKA, NEZÁVISLÝ KANDIDÁT",""
806,1,"ZDENĚK HAMR",56,"učitel","Balkova Lhota","Ano","ZDENĚK HAMR, NEZÁVISLÝ KANDIDÁT",""
802,1,"JAROSLAV NOVOTNÝ",58,"agronom","Balkova Lhota","Ano","JAROSLAV NOVOTNÝ, NEZÁVISLÝ KANDIDÁT",""
804,1,"JOSEF ŠIKA",54,"učitel praktického vyučování","Balkova Lhota","Ne","",""
