"StranaNr","Pořadí","Jméno","Věk","Povolání","Bydliště","Obhajuje","Příslušnost","Minulá kandidatura"
901,1,"HANA VÁCHALOVÁ",51,"OSVČ","Pelechy","Ano","BEZPP","HANA VÁCHALOVÁ, NEZÁVISLÝ KANDIDÁT"
901,7,"EVA MOLINKOVÁ",81,"důchodkyně","Pelechy","Ano","BEZPP","EVA MOLINKOVÁ, NEZÁVISLÝ KANDIDÁT"
901,6,"JOSEF HALADA",51,"zámečník","Pelechy","Ano","BEZPP","JOSEF HALADA, NEZÁVISLÝ KANDIDÁT"
901,3,"JANA BECKOVÁ",39,"administrativní pracovnice","Pelechy","Ano","BEZPP","JANA BECKOVÁ, NEZÁVISLÝ KANDIDÁT"
901,5,"JAN KRÁLOVEC",32,"instalatér","Pelechy","Ano","BEZPP","JAN KRÁLOVEC, NEZÁVISLÝ KANDIDÁT"
901,2,"PETR KRÁLOVEC",35,"instalatér","Pelechy","Ano","BEZPP","PETR KRÁLOVEC, NEZÁVISLÝ KANDIDÁT"
901,4,"RADKA TREMLOVÁ",42,"vedoucí směny","Pelechy","Ne","BEZPP",""
