"StranaNr","Pořadí","Jméno","Věk","Povolání","Bydliště","Obhajuje","Příslušnost","Minulá kandidatura"
805,1,"FILIP DANDA",36,"živnostník","Hrádek","Ano","BEZPP","FILIP DANDA, NEZÁVISLÝ KANDIDÁT"
809,1,"FRANTIŠEK SADIL",67,"OSVČ","Hrádek","Ano","BEZPP","FRANTIŠEK SADIL, NEZÁVISLÝ KANDIDÁT"
802,1,"HANA FEJGLOVÁ",25,"učitelka MŠ","Hrádek","Ano","BEZPP","HANA FEJGLOVÁ, NEZÁVISLÝ KANDIDÁT"
807,1,"HELENA VALÁŠKOVÁ",58,"dělnice","Hrádek","Ano","BEZPP","HELENA VALÁŠKOVÁ, NEZÁVISLÝ KANDIDÁT"
808,1,"KAMIL TŮMA",33,"zaměstnanec TSHK","Hrádek","Ano","BEZPP","KAMIL TŮMA, NEZÁVISLÝ KANDIDÁT"
806,1,"Ing. MILOŠ KALENSKÝ",51,"státní zaměstnanec","Hrádek","Ne","BEZPP","ING. MILOŠ KALENSKÝ, NEZÁVISLÝ KANDIDÁT"
804,1,"LUKÁŠ MRŠTÍK",25,"OSVČ","Hrádek","Ne","BEZPP","LUKÁŠ MRŠTÍK, NEZÁVISLÝ KANDIDÁT"
801,1,"Ing. PETR MĚŘIČEK",51,"OSVČ","Hrádek","Ano","BEZPP","PETR MĚŘIČEK, NEZÁVISLÝ KANDIDÁT"
803,1,"ONDŘEJ VAŇÁTKO",29,"řidič","Hrádek","Ano","BEZPP","ONDŘEJ VAŇÁTKO, NEZÁVISLÝ KANDIDÁT"
