"StranaNr","Pořadí","Jméno","Věk","Povolání","Bydliště","Obhajuje","Příslušnost","Minulá kandidatura"
806,1,"Ing. PETR OLÁH",51,"voják","Libovice","Ne","BEZPP","ING. PETR OLÁH, NEZÁVISLÝ KANDIDÁT"
804,1,"JAKUB TRAPP",21,"řidič sanitky","Libovice","Ne","BEZPP",""
803,1,"MIROSLAV PEJŠEK",61,"podnikatel","Libovice","Ano","BEZPP","MIROSLAV PEJŠEK, NEZÁVISLÝ KANDIDÁT"
801,1,"Ing. MAGDA CURTISOVÁ",45,"v domácnosti","Libovice","Ano","BEZPP","MAGDA CURTISOVÁ, NEZÁVISLÝ KANDIDÁT"
807,1,"ANNA URBANOVÁ",60,"důchodkyně","Libovice","Ano","BEZPP","ANNA URBANOVÁ, NEZÁVISLÝ KANDIDÁT"
808,1,"PETR IBL",46,"OSVČ","Libovice","Ano","BEZPP","PETR IBL, NEZÁVISLÝ KANDIDÁT"
805,1,"STANISLAVA TRAPPOVÁ",41,"vychovatelka, učitelka","Libovice","Ano","BEZPP","STANISLAVA TRAPPOVÁ, NEZÁVISLÝ KANDIDÁT"
802,1,"OTTO JELÍNEK",52,"OSVČ","Libovice","Ano","BEZPP","OTTO JELÍNEK, NEZÁVISLÝ KANDIDÁT"
