"StranaNr","Pořadí","Jméno","Věk","Povolání","Bydliště","Obhajuje","Příslušnost","Minulá kandidatura"
808,1,"JAROSLAV VITÁK",35,"dělník","Zelenecká Lhota","Ne","BEZPP",""
803,1,"JAN JITERSKÝ",41,"učitel","Záhuby","Ano","BEZPP","JAN JITERSKÝ, NEZÁVISLÝ KANDIDÁT"
805,1,"JITKA PROKEŠOVÁ",59,"důchodce","Záhuby","Ne","BEZPP","JITKA PROKEŠOVÁ, NEZÁVISLÝ KANDIDÁT"
806,1,"JAN ROZSYPAL",39,"seřizovač","Zelenecká Lhota","Ano","BEZPP","JAN ROZSYPAL, NEZÁVISLÝ KANDIDÁT"
807,1,"JANA RUNČÍKOVÁ",53,"OSVČ","Zelenecká Lhota","Ano","BEZPP","JANA RUNČÍKOVÁ, NEZÁVISLÝ KANDIDÁT"
804,1,"MAREK KRČMAŘÍK",40,"technik","Zelenecká Lhota","Ano","BEZPP","MAREK KRČMAŘÍK, NEZÁVISLÝ KANDIDÁT"
801,1,"FRANTIŠEK EGRT",38,"zámečník","Zelenecká Lhota","Ano","BEZPP","FRANTIŠEK EGRT, NEZÁVISLÝ KANDIDÁT"
802,1,"EVA HAVLOVÁ",44,"prodavačka","Zelenecká Lhota","Ano","BEZPP","EVA HAVLOVÁ, NEZÁVISLÝ KANDIDÁT"
809,1,"OLDŘICH VYZIBLO",40,"specialista elektro","Zelenecká Lhota","Ne","BEZPP",""
