"StranaNr","Pořadí","Jméno","Věk","Povolání","Bydliště","Obhajuje","Minulá kandidatura","Změnil stranu"
802,1,"JAROSLAVA PIVRNCOVÁ",53,"daňový poradce","Podůlší","Ano","ING. JAROSLAVA PIVRNCOVÁ, NEZÁVISLÝ KANDIDÁT",""
804,1,"ŽANETA KARBANOVÁ",25,"asistentka","Podůlší","Ano","ŽANETA KARBANOVÁ, NEZÁVISLÝ KANDIDÁT",""
805,1,"VLADIMÍR KOŠÍČEK",57,"soustružník","Podůlší","Ano","VLADIMÍR KOŠÍČEK, NEZÁVISLÝ KANDIDÁT",""
801,1,"ZDENĚK ŽALSKÝ",63,"důchodce","Podůlší","Ano","ING. ZDENĚK ŽALSKÝ, NEZÁVISLÝ KANDIDÁT",""
806,1,"JIŘÍ LOUMA",64,"důchodce","Podůlší","Ano","JIŘÍ LOUMA, NEZÁVISLÝ KANDIDÁT",""
808,1,"ZDENĚK KRÁL",50,"OSVČ","Podůlší","Ano","ZDENĚK KRÁL, NEZÁVISLÝ KANDIDÁT",""
807,1,"MILOŠ POSPÍŠIL",25,"instalatér","Podůlší","Ne","",""
803,1,"PETR STRYHAL",28,"projektant","Podůlší","Ne","",""
