"StranaNr","Pořadí","Jméno","Věk","Povolání","Bydliště","Obhajuje","Příslušnost","Minulá kandidatura"
802,1,"JAROSLAVA PIVRNCOVÁ",53,"daňový poradce","Podůlší","Ano","BEZPP","ING. JAROSLAVA PIVRNCOVÁ, NEZÁVISLÝ KANDIDÁT"
806,1,"JIŘÍ LOUMA",64,"důchodce","Podůlší","Ano","BEZPP","JIŘÍ LOUMA, NEZÁVISLÝ KANDIDÁT"
808,1,"ZDENĚK KRÁL",50,"OSVČ","Podůlší","Ano","BEZPP","ZDENĚK KRÁL, NEZÁVISLÝ KANDIDÁT"
801,1,"ZDENĚK ŽALSKÝ",63,"důchodce","Podůlší","Ano","BEZPP","ING. ZDENĚK ŽALSKÝ, NEZÁVISLÝ KANDIDÁT"
803,1,"PETR STRYHAL",28,"projektant","Podůlší","Ne","BEZPP",""
807,1,"MILOŠ POSPÍŠIL",25,"instalatér","Podůlší","Ne","BEZPP",""
805,1,"VLADIMÍR KOŠÍČEK",57,"soustružník","Podůlší","Ano","BEZPP","VLADIMÍR KOŠÍČEK, NEZÁVISLÝ KANDIDÁT"
804,1,"ŽANETA KARBANOVÁ",25,"asistentka","Podůlší","Ano","BEZPP","ŽANETA KARBANOVÁ, NEZÁVISLÝ KANDIDÁT"
