"StranaNr","Pořadí","Jméno","Věk","Povolání","Bydliště","Obhajuje","Příslušnost","Minulá kandidatura"
808,1,"JANA VALENTOVÁ",38,"administrativní pracovnice","Kobylice","Ano","BEZPP","JANA VALENTOVÁ, NEZÁVISLÝ KANDIDÁT"
807,1,"JAN POZLER",36,"OSVČ","Kobylice","Ano","BEZPP","JAN POZLER, NEZÁVISLÝ KANDIDÁT"
803,1,"JIŘÍ LANGR",59,"OSVČ","Kobylice","Ano","BEZPP","JIŘÍ LANGR, NEZÁVISLÝ KANDIDÁT"
801,1,"JAROSLAV NOVOTNÝ",44,"nástrojař","Kobylice","Ano","BEZPP","JAROSLAV NOVOTNÝ, NEZÁVISLÝ KANDIDÁT"
806,1,"LENKA HAVLÍČKOVÁ",43,"referent nepojistných sociálních dávek úřadu práce","Kobylice","Ano","BEZPP","LENKA HAVLÍČKOVÁ, NEZÁVISLÝ KANDIDÁT"
802,1,"FRANTIŠEK KUCHAŘ",48,"dělník","Kobylice","Ano","BEZPP","FRANTIŠEK KUCHAŘ, NEZÁVISLÝ KANDIDÁT"
804,1,"MIROSLAV NOVOTNÝ",67,"důchodce","Kobylice","Ano","BEZPP","MIROSLAV NOVOTNÝ, NEZÁVISLÝ KANDIDÁT"
805,1,"MgA. KAMIL HUSAR",39,"hudebník","Kobylice","Ne","BEZPP",""
