"StranaNr","Pořadí","Jméno","Věk","Povolání","Bydliště","Obhajuje","Příslušnost","Minulá kandidatura"
804,1,"ALEŠ SYCHROVSKÝ",40,"soukromě hospodařící rolník","Vršovka","Ano","BEZPP","ALEŠ SYCHROVSKÝ, NEZÁVISLÝ KANDIDÁT"
801,1,"Ing. JIŘÍ TEPLÝ",50,"manažer prodeje","Vršovka","Ano","BEZPP","JIŘÍ TEPLÝ, NEZÁVISLÝ KANDIDÁT"
806,1,"Bc. LEOŠ PŘIBYL",30,"technický pracovník","Vršovka","Ano","BEZPP","LEOŠ PŘIBYL, NEZÁVISLÝ KANDIDÁT"
802,1,"OLEG LAUDA",40,"dělník","Vršovka","Ne","BEZPP",""
808,1,"ONDŘEJ FÁBERA",48,"konzultant IT","Vršovka","Ano","BEZPP","ONDŘEJ FÁBERA, NEZÁVISLÝ KANDIDÁT"
805,1,"JAKUB RYDLO",20,"student","Vršovka","Ne","BEZPP",""
803,1,"PAVLA DUŠKOVÁ",29,"manažerka","Vršovka","Ne","BEZPP",""
807,1,"MILOŠ ŘEHÁK",55,"údržbář","Vršovka","Ano","BEZPP","MILOŠ ŘEHÁK, NEZÁVISLÝ KANDIDÁT"
