"StranaNr","Pořadí","Jméno","Věk","Povolání","Bydliště","Obhajuje","Minulá kandidatura","Změnil stranu"
901,3,"ZDENĚK ŠIMÁNĚ",39,"THP","Čmelíny","Ano","ZDENĚK ŠIMÁNĚ, NEZÁVISLÝ KANDIDÁT",""
901,2,"JOSEF ŠLAJER",35,"soustružník","Čmelíny","Ne","JOSEF ŠLAJER, NEZÁVISLÝ KANDIDÁT",""
901,5,"VÁCLAV FIALA",41,"THP","Víska","Ano","VÁCLAV FIALA, NEZÁVISLÝ KANDIDÁT",""
901,4,"MILAN KUBÁT",58,"lakýrník","Čmelíny","Ano","MILAN KUBÁT, NEZÁVISLÝ KANDIDÁT",""
901,1,"HELENA PRÁGROVÁ",63,"důchodce","Čmelíny","Ne","",""
