"StranaNr","Pořadí","Jméno","Věk","Povolání","Bydliště","Obhajuje","Příslušnost","Minulá kandidatura"
807,1,"IVA PAULOVÁ",50,"invalidní důchodce","Plchovice","Ne","BEZPP","IVA PAULOVÁ, NEZÁVISLÝ KANDIDÁT"
804,1,"PAVEL CHADIMA",49,"elektrikář","Smetana","Ne","BEZPP",""
801,1,"JANA SLÁDKOVÁ",43,"učitelka MŠ","Plchovice","Ano","BEZPP","JANA SLÁDKOVÁ, NEZÁVISLÝ KANDIDÁT"
802,1,"MICHAELA SLÁDKOVÁ",44,"kuchařka","Plchovice","Ano","BEZPP","MICHAELA SLÁDKOVÁ, NEZÁVISLÝ KANDIDÁT"
806,1,"Mgr. PETR VÍŠEK",35,"Vedoucí obvodního oddělení Policie ČR (Choceň)","Plchovice","Ne","BEZPP",""
803,1,"MARIE ŽIŽKOVÁ",61,"důchodce","Plchovice","Ne","BEZPP",""
808,1,"PAVEL HABĚTÍN",48,"Podnikatel","Plchovice","Ano","BEZPP","PAVEL HABĚTÍN, NEZÁVISLÝ KANDIDÁT"
805,1,"PETR DOSTÁL",40,"servisní technik","Smetana","Ano","BEZPP","PETR DOSTÁL, NEZÁVISLÝ KANDIDÁT"
