"StranaNr","Pořadí","Jméno","Věk","Povolání","Bydliště","Obhajuje","Příslušnost","Minulá kandidatura"
809,1,"JANA NOVOTNÁ",46,"Vedoucí výrobního střediska (mistr)","Seč","Ne","BEZPP",""
807,1,"Bc. DANIEL KAPLAN",25,"Student","Seč","Ne","BEZPP",""
803,1,"TOMÁŠ LAJZA",39,"OSVČ","Seč","Ano","BEZPP","TOMÁŠ LAJZA, NEZÁVISLÝ KANDIDÁT"
804,1,"LUKÁŠ ŠRAJER",35,"Vedoucí výrobního střediska (mistr)","Seč","Ne","BEZPP","LUKÁŠ ŠRAJER, NEZÁVISLÝ KANDIDÁT"
802,1,"KATEŘINA HARUŠŤÁKOVÁ",28,"Práce účetní a administrativní","Seč","Ne","BEZPP",""
808,1,"LUKÁŠ ČABAN",29,"SŽDC s.o.,vrchní mistr zabezpečovací techniky","Seč","Ne","BEZPP",""
806,1,"Bc. SABINA KAPLANOVÁ",32,"Vedoucí ONP OSSZ ÚO","Seč","Ne","BEZPP",""
805,1,"PAVEL PODHÁJECKÝ",25,"Dělník","Seč","Ne","BEZPP",""
801,1,"RADEK DOSTÁLEK",32,"Technik","Seč","Ne","BEZPP",""
