"StranaNr","Pořadí","Jméno","Věk","Povolání","Bydliště","Obhajuje","Příslušnost","Minulá kandidatura"
806,1,"ALEŠ NEJEZ",62,"jednatel společnosti","Braníškov","Ano","BEZPP","ALEŠ NEJEZ, NEZÁVISLÝ KANDIDÁT"
807,1,"Bc. EVA ZAVŘELOVÁ",41,"účetní","Braníškov","Ne","BEZPP",""
801,1,"LIBOR KLUSÁK",40,"ostřič nástrojů","Braníškov","Ano","BEZPP","LIBOR KLUSÁK, NEZÁVISLÝ KANDIDÁT"
804,1,"Ing. JOSEF POKORNÝ",53,"soukromý zemědělec","Braníškov","Ano","BEZPP","ING. JOSEF POKORNÝ, NEZÁVISLÝ KANDIDÁT"
803,1,"ZDENĚK ŠOTOLA",74,"důchodce","Braníškov","Ano","BEZPP","ZDENĚK ŠOTOLA, NEZÁVISLÝ KANDIDÁT"
808,1,"VLADIMÍR SEKANINA",55,"živnostník","Braníškov","Ne","BEZPP",""
805,1,"LIBOR DVOŘÁČEK",36,"zedník","Braníškov","Ano","BEZPP","LIBOR DVOŘÁČEK, NEZÁVISLÝ KANDIDÁT"
802,1,"Ing. PETR CHROMEK",40,"projektant","Braníškov","Ano","BEZPP","ING. PETR CHROMEK, NEZÁVISLÝ KANDIDÁT"
