"StranaNr","Pořadí","Jméno","Věk","Povolání","Bydliště","Obhajuje","Příslušnost","Minulá kandidatura"
901,7,"Bc. MAREK MLČOCH",36,"vedoucí oddělení","Lešany","Ano","BEZPP","MAREK MLČOCH, NEZÁVISLÝ KANDIDÁT"
901,2,"PAVEL KOMÁREK",49,"technik STK","Lešany","Ano","BEZPP","PAVEL KOMÁREK, NEZÁVISLÝ KANDIDÁT"
901,5,"ANDREA MALÍŠKOVÁ",39,"zahradnice","Lešany","Ano","BEZPP","ANDREA MALÍŠKOVÁ, NEZÁVISLÝ KANDIDÁT"
901,3,"DRAHOMÍRA KUBESOVÁ",56,"vychovatelka","Lešany","Ano","BEZPP","DRAHOMÍRA KUBESOVÁ, NEZÁVISLÝ KANDIDÁT"
901,6,"LUBOMÍR MLČOCH",60,"OSVČ","Lešany","Ano","BEZPP","LUBOMÍR MLČOCH, NEZÁVISLÝ KANDIDÁT"
901,1,"STANISLAV FALTÝNEK",50,"místostarosta obce","Lešany","Ano","BEZPP","STANISLAV FALTÝNEK, NEZÁVISLÝ KANDIDÁT"
901,4,"VOJTĚCH KUDLIČKA",44,"řidič autobusu","Lešany","Ne","BEZPP",""
901,8,"Ing. VLADISLAVA BÁBKOVÁ",39,"vedoucí útvaru kontroly","Lešany","Ano","BEZPP","VLADISLAVA BÁBKOVÁ, NEZÁVISLÝ KANDIDÁT"
