"StranaNr","Pořadí","Jméno","Věk","Povolání","Bydliště","Obhajuje","Příslušnost","Minulá kandidatura"
803,1,"BOHUMIL PEŠL",47,"THP","Dědice","Ano","BEZPP","BOHUMIL PEŠL, NEZÁVISLÝ KANDIDÁT"
809,1,"DANA NĚMCOVÁ",31,"pracovník v sociálních službách","Dědice","Ne","BEZPP",""
807,1,"JAROSLAV TEJRAL",35,"dělník","Dědice","Ano","BEZPP","JAROSLAV TEJRAL, NEZÁVISLÝ KANDIDÁT"
801,1,"FRANTIŠEK MANDÁT",47,"dělník","Dědice","Ano","BEZPP","FRANTIŠEK MANDÁT, NEZÁVISLÝ KANDIDÁT"
802,1,"LUDMILA MANDÁTOVÁ",45,"THP","Dědice","Ne","BEZPP",""
804,1,"RADEK MADERKA",43,"dělník","Dědice","Ne","BEZPP",""
808,1,"LIBOR JANOUŠEK",30,"elektrikář","Dědice","Ano","BEZPP","LIBOR JANOUŠEK, NEZÁVISLÝ KANDIDÁT"
806,1,"ROMAN DOHNAL",36,"dělník","Dědice","Ano","BEZPP","ROMAN DOHNAL, NEZÁVISLÝ KANDIDÁT"
805,1,"VĚRA MADERKOVÁ",38,"dělník","Dědice","Ne","BEZPP",""
