"StranaNr","Pořadí","Jméno","Věk","Povolání","Bydliště","Obhajuje","Příslušnost","Minulá kandidatura"
806,1,"ALEŠ ŠOTKOVSKÝ",42,"ředitel","Kojatice","Ano","BEZPP","ALEŠ ŠOTKOVSKÝ, NEZÁVISLÝ KANDIDÁT"
805,1,"BOHUMIL MICHAL",52,"zemědělský dělník","Kojatice","Ano","BEZPP","BOHUMIL MICHAL, NEZÁVISLÝ KANDIDÁT"
802,1,"BOŽENA BUČKOVÁ",48,"bez zaměstnání","Kojatice","Ano","BEZPP","BOŽENA BUČKOVÁ, NEZÁVISLÝ KANDIDÁT"
803,1,"JANA ŠAFRATOVÁ",39,"aktivizační pracovnice","Kojatice","Ano","BEZPP","JANA ŠAFRATOVÁ, NEZÁVISLÝ KANDIDÁT"
807,1,"BOŽENA MOLTAŠOVÁ",54,"účetní","Kojatice","Ne","BEZPP",""
801,1,"MARTIN BENDA",45,"svářeč","Kojatice","Ano","BEZPP","MARTIN BENDA, NEZÁVISLÝ KANDIDÁT"
808,1,"PAVEL DAŇHEL",43,"OSVČ","Kojatice","Ano","BEZPP","PAVEL DAŇHEL, NEZÁVISLÝ KANDIDÁT"
804,1,"JOSEF JEŽEK",45,"dělník","Kojatice","Ano","BEZPP","JOSEF JEŽEK, NEZÁVISLÝ KANDIDÁT"
