"StranaNr","Pořadí","Jméno","Věk","Povolání","Bydliště","Obhajuje","Příslušnost","Minulá kandidatura"
901,1,"FRANTIŠEK KOMENDA",54,"řidič","Lubnice","Ano","BEZPP","FRANTIŠEK KOMENDA, NEZÁVISLÝ KANDIDÁT"
901,3,"JINDŘIŠKA JEDLIČKOVÁ",68,"důchodce","Lubnice","Ano","BEZPP","JINDŘIŠKA JEDLIČKOVÁ, NEZÁVISLÝ KANDIDÁT"
802,1,"JITKA JANOUŠKOVÁ",32,"živnostník","Lubnice","Ano","BEZPP","JITKA JANOUŠKOVÁ, NEZÁVISLÝ KANDIDÁT"
901,2,"Ing. HELENA HROUDNÁ",60,"důchodce","Lubnice","Ano","BEZPP","HELENA HROUDNÁ, NEZÁVISLÝ KANDIDÁT"
804,1,"PETR DLOUHÝ",41,"dělník","Lubnice","Ne","BEZPP",""
901,4,"JANA GRITSCHOVÁ",57,"uklízečka","Lubnice","Ano","BEZPP","JANA GRITSCHOVÁ, NEZÁVISLÝ KANDIDÁT"
901,5,"ANTONÍN SVOBODA",66,"důchodce","Lubnice","Ne","BEZPP","ANTONÍN SVOBODA, NEZÁVISLÝ KANDIDÁT"
803,1,"VENDULA ČERNOVICKÁ",26,"student","Lubnice","Ne","BEZPP",""
801,1,"NADĚŽDA VEVEROVÁ",42,"v domácnosti","Lubnice","Ne","BEZPP",""
