"StranaNr","Pořadí","Jméno","Věk","Povolání","Bydliště","Obhajuje","Minulá kandidatura","Změnil stranu"
806,1,"RADEK POSPÍŠIL",41,"kontrolor výstupu","Horní Radslavice","Ne","RADEK POSPÍŠIL, NEZÁVISLÝ KANDIDÁT",""
805,1,"OTAKAR MIKYSKA",56,"OSVČ","Horní Radslavice","Ano","OTAKAR MIKYSKA, NEZÁVISLÝ KANDIDÁT",""
804,1,"JITKA DOHNALOVÁ",44,"dělnice","Horní Radslavice","Ano","JITKA DOHNALOVÁ, NEZÁVISLÝ KANDIDÁT",""
801,1,"ZDENĚK KAFKA",43,"OSVČ","Horní Radslavice","Ano","ZDENĚK KAFKA, NEZÁVISLÝ KANDIDÁT",""
802,1,"MAGDA KOMÍNKOVÁ",41,"finanční účetní","Horní Radslavice","Ano","MAGDA KOMÍNKOVÁ, NEZÁVISLÝ KANDIDÁT",""
803,1,"MARTIN DOHNAL",23,"zámečník","Horní Radslavice","Ne","",""
