"StranaNr","Pořadí","Jméno","Věk","Povolání","Bydliště","Obhajuje","Příslušnost","Minulá kandidatura"
809,1,"PETR SOBOTKA",33,"živnostník","Nový Jimramov","Ne","BEZPP","PETR SOBOTKA, NEZÁVISLÝ KANDIDÁT"
804,1,"Ing. BOHUMIL UHERKA",26,"programátor","Nový Jimramov","Ano","BEZPP","BOHUMIL UHERKA, NEZÁVISLÝ KANDIDÁT"
806,1,"HANA JÍLKOVÁ",47,"učitelka MŠ","Nový Jimramov","Ano","BEZPP","HANA JÍLKOVÁ, NEZÁVISLÝ KANDIDÁT"
801,1,"JAROSLAV BENEŠ",56,"nezaměstnaný","Nový Jimramov","Ano","BEZPP","JAROSLAV BENEŠ, NEZÁVISLÝ KANDIDÁT"
802,1,"JAN LUPAČ",29,"živnostník","Nový Jimramov","Ano","BEZPP","JAN LUPAČ, NEZÁVISLÝ KANDIDÁT"
807,1,"HANA URBÁNKOVÁ",38,"nezaměstnaná","Jimramovské Paseky","Ano","BEZPP","HANA URBÁNKOVÁ, NEZÁVISLÝ KANDIDÁT"
808,1,"JOSEF BUREŠ",75,"důchodce","Nový Jimramov","Ne","BEZPP","JOSEF BUREŠ, NEZÁVISLÝ KANDIDÁT"
803,1,"MILOŠ NEDĚLA",57,"zedník","Nový Jimramov","Ano","BEZPP","MILOŠ NEDĚLA, NEZÁVISLÝ KANDIDÁT"
805,1,"RADEK PRUDKÝ",42,"mistr","Jimramovské Paseky","Ne","BEZPP",""
