"StranaNr","Pořadí","Jméno","Věk","Povolání","Bydliště","Obhajuje","Příslušnost","Minulá kandidatura"
801,1,"JIŘÍ JAKEŠ",38,"podnikatel","Tišnovská Nová Ves","Ne","BEZPP",""
1,3,"MUDr. MICHAELA FICOVÁ",45,"lékařka","Tišnovská Nová Ves","Ne","BEZPP",""
805,1,"Mgr. PETRA JAKEŠOVÁ",28,"odborný asistent na VŠ","Tišnovská Nová Ves","Ne","BEZPP",""
1,1,"Ing. VLADISLAV FIC",51,"daňový poradce","Tišnovská Nová Ves","Ano","BEZPP","ING. VLADISLAV FIC, NEZÁVISLÝ KANDIDÁT"
1,2,"Ing. PETR JANDA",41,"technik","Tišnovská Nová Ves","Ano","BEZPP","ING. PETR JANDA, NEZÁVISLÝ KANDIDÁT"
804,1,"Ing. VLADIMÍR KRÉZEK",28,"IT specialista","Tišnovská Nová Ves","Ano","BEZPP","BC. VLADIMÍR KRÉZEK, NEZÁVISLÝ KANDIDÁT"
803,1,"VLADIMÍR KRÉZEK",54,"zedník","Tišnovská Nová Ves","Ano","BEZPP","VLADIMÍR KRÉZEK, NEZÁVISLÝ KANDIDÁT"
802,1,"VLADIMÍR JAKEŠ",37,"řidič","Tišnovská Nová Ves","Ano","BEZPP","VLADIMÍR JAKEŠ, NEZÁVISLÝ KANDIDÁT"
