"StranaNr","Pořadí","Jméno","Věk","Povolání","Bydliště","Obhajuje","Příslušnost","Minulá kandidatura"
808,1,"JARMILA ZIMMERMANNOVÁ",66,"důchodkyně","Záhoří","Ne","BEZPP",""
802,1,"MILAN PRÁŠEK",55,"řidič","Záhoří","Ano","BEZPP","MILAN PRÁŠEK, NEZÁVISLÝ KANDIDÁT"
801,1,"JAROSLAV KOVÁŘ",68,"důchodce","Záhoří","Ano","BEZPP","JAROSLAV KOVÁŘ, NEZÁVISLÝ KANDIDÁT"
807,1,"JOSEF LOSKOT",72,"důchodce","Záhoří","Ne","BEZPP",""
806,1,"LADISLAV ŠÍMA",69,"důchodce","Záhoří","Ano","BEZPP","LADISLAV ŠÍMA, NEZÁVISLÝ KANDIDÁT"
803,1,"OLGA MAREŠOVÁ",40,"účetní","Záhoří","Ano","BEZPP","OLGA MAREŠOVÁ, NEZÁVISLÝ KANDIDÁT"
804,1,"VÁCLAV HRUBÝ",30,"OSVČ","Záhoří","Ano","BEZPP","VÁCLAV HRUBÝ, NEZÁVISLÝ KANDIDÁT"
805,1,"ZDEŇKA PRÁŠKOVÁ",50,"administrativní pracovnice","Záhoří","Ano","BEZPP","ZDEŇKA PRÁŠKOVÁ, NEZÁVISLÝ KANDIDÁT"
