"StranaNr","Pořadí","Jméno","Věk","Povolání","Bydliště","Obhajuje","Minulá kandidatura","Změnil stranu"
801,1,"TOMÁŠ ŠTRYCH",28,"IT koordinátor","Horní Slivno","Ano","TOMÁŠ ŠTRYCH, NEZÁVISLÝ KANDIDÁT",""
807,1,"PETRA NOVOTNÁ",46,"vedoucí pošty","Horní Slivno","Ano","PETRA NOVOTNÁ, NEZÁVISLÝ KANDIDÁT",""
805,1,"JAROSLAV PŘIBYL",57,"kontrolor","Horní Slivno","Ano","JAROSLAV PŘIBYL, NEZÁVISLÝ KANDIDÁT",""
802,1,"MILAN NOVOTNÝ",50,"ved. RV. ZD. Mečeříž","Horní Slivno","Ano","MILAN NOVOTNÝ, NEZÁVISLÝ KANDIDÁT",""
806,1,"MARIE VESELÁ",59,"signalistka","Horní Slivno","Ano","MARIE VESELÁ, NEZÁVISLÝ KANDIDÁT",""
808,1,"RADEK JANATA",44,"karosář Škoda auto a.s.","Horní Slivno","Ano","RADEK JANATA, NEZÁVISLÝ KANDIDÁT",""
809,1,"Ing. LIBUŠE PŘIBYLOVÁ",57,"OSVČ","Horní Slivno","Ano","LIBUŠE PŘIBYLOVÁ, NEZÁVISLÝ KANDIDÁT",""
803,1,"LUCIE BERGEROVÁ",31,"rodičovská dovolená","Horní Slivno","Ne","",""
804,1,"MILUŠE PLUSKALOVÁ",58,"podnikatelka","Horní Slivno","Ne","",""
