"StranaNr","Pořadí","Jméno","Věk","Povolání","Bydliště","Obhajuje","Příslušnost","Minulá kandidatura"
804,1,"JANA ZEMANOVÁ",37,"učitelka","Vrbice","Ano","BEZPP","JANA ZEMANOVÁ, NEZÁVISLÝ KANDIDÁT"
808,1,"Ing. JIŘÍ ŠIMÁK",52,"projektant chlad. zařízení","Vrbice","Ne","BEZPP",""
805,1,"JIŘÍ KOS",41,"živnostník","Vrbice","Ne","BEZPP",""
802,1,"JANA SMLSALOVÁ",52,"ekonomka","Vrbice","Ano","BEZPP","JANA SMLSALOVÁ, NEZÁVISLÝ KANDIDÁT"
801,1,"BOHUMIL ZELINKA",49,"finanční účetní","Vrbice","Ano","BEZPP","BOHUMIL ZELINKA, NEZÁVISLÝ KANDIDÁT"
806,1,"JIŘÍ HAVRÁNEK",55,"soukromý zemědělec","Vrbice","Ano","BEZPP","JIŔÍ HAVRÁNEK, NEZÁVISLÝ KANDIDÁT"
807,1,"JOSEF JIRÁNEK",59,"důchodce","Vrbice","Ano","BEZPP","JOSEF JIRÁNEK, NEZÁVISLÝ KANDIDÁT"
803,1,"SHAFI BAEZ",42,"vedoucí servisu","Vrbice","Ano","BEZPP","SHAFI BAEZ, NEZÁVISLÝ KANDIDÁT"
