"Strana","Počet kandidátů","Průměrný věk","Podíl žen","Akademický titul","Mandát obhajuje","Změna strany","StranaNr"
"KŘESŤANSKÁ A DEMOKRATICKÁ UNIE - ČESKOSLOVENSKÁ STRANA LIDOVÁ","9/9","52,1","33%","56%","2",1,1
"PATRIOTI PRO LUKOU, JEŠOV, STŘEMENÍČKO, VESELÍČKO, BŘEZINU A JAVOŘÍČKO","9/9","45,4","67%","11%","0",0,509
"STRANA SVOBODNÝCH OBČANŮ","5/9","38,8","0%","40%","0",0,714
"SDRUŽENÍ NEZÁVISLÝCH KANDIDÁTŮ","9/9","44,1","33%","11%","5",1,901
"PRO OBEC A OBČANY","9/9","36,2","11%","22%","2",0,902
