"Strana","Počet kandidátů","Průměrný věk","Podíl žen","Akademický titul","Mandát obhajuje","Změna strany","StranaNr"
"V BYSTŘICI JSME VŠICHNI DOMA! KDU-ČSL.","15/15","47,5","53%","47%","3",0,1
"KOMUNISTICKÁ STRANA ČECH A MORAVY","15/15","61,3","27%","13%","1",0,47
"ČESKÁ STRANA SOCIÁLNĚ DEMOKRATICKÁ","15/15","47,8","60%","27%","1",0,7
"HLINÍK PLUS","15/15","44,2","40%","40%","2",1,901
"SDRUŽENÍ NEZÁVISLÝCH KANDIDÁTŮ JSME TU PRO BYSTŘICI","15/15","42,5","60%","27%","8",0,902
"SDRUŽENÍ NEZÁVISLÝCH KANDIDÁTŮ ""ZA PŘÍJEMNÝ ŽIVOT""","15/15","48,1","20%","80%","0",0,903
