"Strana","Počet kandidátů","Mandát obhajuje","Změna strany","Nováčci","Průměrný věk","Podíl žen","Akademický titul","StranaNr"
"KŘESŤANSKÁ A DEMOKRATICKÁ UNIE - ČESKOSLOVENSKÁ STRANA LIDOVÁ","15/15","2",0,"3","46,3","13%","33%",1
"KOMUNISTICKÁ STRANA ČECH A MORAVY","7/15","0",2,"5","58,1","43%","14%",47
"ČESKÁ STRANA SOCIÁLNĚ DEMOKRATICKÁ","15/15","2",0,"7","47,5","13%","27%",7
"DOLNÍ BENEŠOV A ZÁBŘEH - VĚC VEŘEJNÁ","15/15","2",0,"5","42,1","27%","40%",901
"SDRUŽENÍ OBČANŮ DOLNÍHO BENEŠOVA A ZÁBŘEHU","15/15","5",0,"1","49,5","20%","33%",902
"SDRUŽENÍ NEZÁVISLÝCH KANDIDÁTŮ - DOLNÍ BENEŠOV A ZÁBŘEH","15/15","0",11,"4","39,3","47%","53%",903
