"Strana","Počet kandidátů","Mandát obhajuje","Změna strany","Nováčci","Průměrný věk","Podíl žen","Akademický titul","StranaNr"
"KŘESŤANSKÁ A DEMOKRATICKÁ UNIE - ČESKOSLOVENSKÁ STRANA LIDOVÁ","15/15","0",1,"14","49,1","20%","7%",1
"SPOLEČNĚ PRO HORNÍ MOŠTĚNICI","15/15","0",8,"7","43,5","13%","13%",389
"ČESKÁ STRANA SOCIÁLNĚ DEMOKRATICKÁ","15/15","2",0,"5","44,6","13%","27%",7
"SDRUŽENÍ SPORTOVCŮ PRO OBEC","15/15","2",0,"5","49,5","13%","20%",901
"SDRUŽENÍ NEZÁVISLÝCH PRO RODINU A ROZVOJ OBCE HORNÍ MOŠTĚNICE","14/15","0",6,"8","44,1","50%","43%",902
"SDRUŽENÍ NEZÁVISLÝCH KANDIDÁTŮ","15/15","4",2,"6","49,3","53%","40%",903
