"Strana","Počet kandidátů","Mandát obhajuje","Změna strany","Nováčci","Průměrný věk","Podíl žen","Akademický titul","StranaNr"
"KŘESŤANSKÁ A DEMOKRATICKÁ UNIE - ČESKOSLOVENSKÁ STRANA LIDOVÁ","9/9","4",0,"4","47,3","67%","22%",1
"KOMUNISTICKÁ STRANA ČECH A MORAVY","9/9","1",0,"5","56,2","33%","0%",47
"S LÁSKOU, VÍROU A NADĚJÍ","9/9","0",0,"0","46,3","89%","22%",470
"ČESKÁ STRANA SOCIÁLNĚ DEMOKRATICKÁ","9/9","2",2,"2","46,4","0%","0%",7
"STRANA PRÁV OBČANŮ","9/9","0",3,"6","38,7","22%","11%",724
"NAŠE LOBODICE-SDRUŽENÍ NEZÁVISLÝCH KANDIDÁTŮ","9/9","0",4,"5","40,3","22%","44%",901
"""NOVÁ CESTA""","9/9","0",1,"8","46,7","67%","0%",902
