"Strana","Počet kandidátů","Průměrný věk","Podíl žen","Akademický titul","Mandát obhajuje","Změna strany","StranaNr"
"FRANTIŠEK SEMRÁD, NEZÁVISLÝ KANDIDÁT","1/7","62","0%","0%","0",0,801
"MICHAL JUNEK, NEZÁVISLÝ KANDIDÁT","1/7","32","0%","0%","0",0,802
"JAROSLAVA ŠVEJDOVÁ, NEZÁVISLÝ KANDIDÁT","1/7","58","100%","0%","1",0,803
"MARCELA DVOŘÁKOVÁ, NEZÁVISLÝ KANDIDÁT","1/7","37","100%","0%","1",0,804
"JIŘÍ VOJTA, NEZÁVISLÝ KANDIDÁT","1/7","62","0%","0%","1",0,805
"MILAN PŘIBYL, NEZÁVISLÝ KANDIDÁT","1/7","34","0%","0%","1",0,806
"JAN VYHLÍDKA, NEZÁVISLÝ KANDIDÁT","1/7","64","0%","0%","1",0,807
"KAREL MLEZIVA, NEZÁVISLÝ KANDIDÁT","1/7","66","0%","0%","1",0,808
"JIŘÍ NOVÁK, NEZÁVISLÝ KANDIDÁT","1/7","35","0%","0%","1",0,809
