"Strana","Počet kandidátů","Mandát obhajuje","Změna strany","Nováčci","Průměrný věk","Podíl žen","Akademický titul","StranaNr"
"PETR ČECH, NEZÁVISLÝ KANDIDÁT","1/7","0",0,"0","40","0%","0%",801
"ALENA ČECHOVÁ, NEZÁVISLÝ KANDIDÁT","1/7","1",0,"0","41","100%","0%",802
"ROMAN DVOŘÁČEK, NEZÁVISLÝ KANDIDÁT","1/7","1",0,"0","44","0%","0%",803
"BLANKA KNEDLHANSOVÁ, NEZÁVISLÝ KANDIDÁT","1/7","0",0,"0","22","100%","0%",804
"VÁCLAV KNEDLHANS, NEZÁVISLÝ KANDIDÁT","1/7","1",0,"0","55","0%","0%",805
"JAN KOŽÍŠEK, NEZÁVISLÝ KANDIDÁT","1/7","1",0,"0","57","0%","100%",806
"KAREL ŠILHAN, NEZÁVISLÝ KANDIDÁT","1/7","0",0,"0","68","0%","0%",807
"MARKÉTA ŘENČOVÁ, NEZÁVISLÝ KANDIDÁT","1/7","0",0,"0","39","100%","0%",808
"MARTIN ŘENČ, NEZÁVISLÝ KANDIDÁT","1/7","1",0,"0","40","0%","0%",809
