"Strana","Počet kandidátů","Průměrný věk","Podíl žen","Akademický titul","Mandát obhajuje","Změna strany","StranaNr"
"NEZÁVISLÝ KANDIDÁT JAROSLAV VÁŠA","1/5","57","0%","0%","1",0,801
"NEZÁVISLÝ KANDIDÁT MGR. JAN PAVEL","1/5","39","0%","100%","1",0,802
"NEZÁVISLÝ KANDIDÁT ZDENĚK KREJČÍK","1/5","35","0%","0%","1",0,803
"MILAN ROHLÍČEK","1/5","23","0%","0%","1",0,804
"NEZÁVISLÝ KANDIDÁT LUBOMÍR KOUDELKA","1/5","46","0%","0%","1",0,805
"DAŇKOVÁ HELENA-NEZÁVISLÝ KANDIDÁT","1/5","59","100%","0%","0",0,806
