"Strana","Počet kandidátů","Průměrný věk","Podíl žen","Akademický titul","Mandát obhajuje","Změna strany","StranaNr"
"SDRUŽENÍ NEZÁVISLÝCH KANDIDÁTŮ -  SBOR DOBROVOLNÝCH HASIČŮ","9/9","43,9","22%","11%","3",0,901
"SDRUŽENÍ NEZÁVISLÝCH KANDIDÁTŮ TŘEBANĚ","9/9","41,9","44%","0%","2",0,902
"SDRUŽENÍ NEZÁVISLÝCH KANDIDÁTŮ ZA TŘEBAŇ KRÁSNĚJŠÍ","9/9","51,4","44%","0%","4",0,903
"SPOLEČNĚ PRO TŘEBAŇ","9/9","41,3","56%","56%","0",0,904
"SDRUŽENÍ SALTO A NEZÁVISLÍ KANDIDÁTI","9/9","40","78%","67%","0",0,905
