"Strana","Počet kandidátů","Průměrný věk","Podíl žen","Akademický titul","Mandát obhajuje","Změna strany","StranaNr"
"FAIR PLAY - HNPD, HNUTÍ NA PODPORU DOBROVOLNÝCH HASIČŮ A DALŠÍCH DOBROVOLNÍKŮ","9/9","47,1","33%","22%","4",0,167
"SDRUŽENÍ KOMUNISTICKÁ STRANA ČECH A MORAVY A NEZÁVISLÍ KANDIDÁTI","9/9","60,4","22%","0%","1",1,387
"PLAŇAŇÁCI","9/9","46,3","33%","11%","0",3,470
"ČESKÁ STRANA SOCIÁLNĚ DEMOKRATICKÁ","6/9","32,3","17%","33%","0",0,7
"PLAŇANŠTÍ AUTODOPRAVCI","9/9","44,3","0%","0%","2",0,901
"SDRUŽENÍ PRO SPORT A MLÁDEŽ","9/9","40,6","11%","22%","1",1,902
