"Strana","Počet kandidátů","Průměrný věk","Podíl žen","Akademický titul","Mandát obhajuje","Změna strany","StranaNr"
"KŘESŤANSKÁ A DEMOKRATICKÁ UNIE - ČESKOSLOVENSKÁ STRANA LIDOVÁ","15/15","48,4","60%","67%","0",0,1
"HLAS KLÁNOVIC - ČSSD A NEZÁVISLÍ","15/15","47","47%","47%","2",0,371
"KLÁNOVICKÁ PRAVICE, SDRUŽENÍ OBČANSKÉ DEMOKRATICKÉ STRANY (ODS) A NEZÁVISLÝCH KANDIDÁTŮ","15/15","50,5","27%","60%","0",0,389
"STAN KLÁNOVICE","15/15","52,4","47%","40%","0",6,470
"ČAS NA ZMĚNU SDRUŽENÍ LES, PIRÁTI, NK","15/15","47,2","40%","53%","0",4,552
"SPOLU PRO KLÁNOVICE-SDRUŽENÍ NEZÁVISLÝCH KANDIDÁTŮ","15/15","47,9","53%","100%","3",0,901
