"Strana","Počet kandidátů","Průměrný věk","Podíl žen","Akademický titul","Mandát obhajuje","Změna strany","StranaNr"
"FRANTIŠEK ONDŘICH, NEZÁVISLÝ KANDIDÁT","1/7","65","0%","0%","1",0,801
"NORBERT NEWALD, NEZÁVISLÝ KANDIDÁT","1/7","42","0%","0%","0",0,802
"PAVEL ZOULA, NEZÁVISLÝ KANDIDÁT","1/7","50","0%","0%","1",0,803
"ZDEŇKA NOVÁKOVÁ, NEZÁVISLÝ KANDIDÁT","1/7","40","100%","100%","1",0,804
"MARTIN ŠVEDA, NEZÁVISLÝ KANDIDÁT","1/7","47","0%","100%","1",0,805
"LUKÁŠ BAREŠ, NEZÁVISLÝ KANDIDÁT","1/7","30","0%","100%","1",0,806
"PETR KAVALÍŘ, NEZÁVISLÝ KANDIDÁT","1/7","56","0%","0%","1",0,807
