"Strana","Počet kandidátů","Průměrný věk","Podíl žen","Akademický titul","Mandát obhajuje","Změna strany","StranaNr"
"PAVEL BAROCH, NEZÁVISLÝ KANDIDÁT","1/7","58","0%","0%","1",0,801
"JIŘÍ MATAS, NEZÁVISLÝ KANDIDÁT","1/7","44","0%","0%","0",0,802
"JAROSLAV TOMKA, NEZÁVISLÝ KANDIDÁT","1/7","47","0%","0%","0",0,803
"ŠTEFAN CEHELSKÝ, NEZÁVISLÝ KANDIDÁT","1/7","52","0%","0%","1",0,804
"FRANTIŠEK BOUZEK, NEZÁVISLÝ KANDIDÁT","1/7","63","0%","0%","0",0,805
"MIROSLAV STANĚK, NEZÁVISLÝ KANDIDÁT","1/7","65","0%","0%","1",0,806
"LENKA STREJCOVÁ, NEZÁVISLÝ KANDIDÁT","1/7","52","100%","0%","1",0,807
"JOSEF SEJPKA, NEZÁVISLÝ KANDIDÁT","1/7","30","0%","100%","1",0,808
