"Strana","Počet kandidátů","Průměrný věk","Podíl žen","Akademický titul","Mandát obhajuje","Změna strany","StranaNr"
"KŘESŤANSKÁ A DEMOKRATICKÁ UNIE - ČESKOSLOVENSKÁ STRANA LIDOVÁ","19/19","45,2","32%","26%","1",1,1
"ZELENÁ PRO ROŽMITÁL","19/19","37,8","42%","37%","0",5,364
"KOMUNISTICKÁ STRANA ČECH A MORAVY","19/19","60,1","42%","16%","6",0,47
"OBČANSKÁ DEMOKRATICKÁ STRANA (ODS) A ROŽMITÁLŠTÍ PATRIOTÉ","19/19","51,6","16%","21%","4",1,53
"ČESKÁ STRANA SOCIÁLNĚ DEMOKRATICKÁ","19/19","44,4","21%","32%","2",0,7
"SDRUŽENÍ NEZÁVISLÝCH KANDIDÁTŮ","19/19","54,1","21%","42%","2",1,901
