"Strana","Počet kandidátů","Průměrný věk","Podíl žen","Akademický titul","Mandát obhajuje","Změna strany","StranaNr"
"KŘESŤANSKÁ A DEMOKRATICKÁ UNIE - ČESKOSLOVENSKÁ STRANA LIDOVÁ","15/15","56,7","60%","13%","2",2,1
"KOMUNISTICKÁ STRANA ČECH A MORAVY","15/15","48,3","47%","0%","3",0,47
"SBOR DOBROVOLNÝCH HASIČŮ BRANKY","15/15","37","33%","13%","4",2,901
"NEZÁVISLÍ PRO BRANKY","15/15","42,3","20%","47%","3",1,902
"SPOLEK PRO OBNOVU ZÁMECKÉHO PARKU A ROZVOJ BRANEK","15/15","49,8","60%","20%","1",2,903
"SNK TJ SOKOL BRANKY","15/15","42,1","13%","7%","0",0,904
