"Strana","Počet kandidátů","Průměrný věk","Podíl žen","Akademický titul","Mandát obhajuje","Změna strany","StranaNr"
"KŘESŤANSKÁ A DEMOKRATICKÁ UNIE - ČESKOSLOVENSKÁ STRANA LIDOVÁ","15/15","47,2","27%","20%","2",0,1
"OBČANSKÁ DEMOKRATICKÁ STRANA A NEZÁVISLÍ","15/15","50,1","27%","33%","0",3,389
"KOMUNISTICKÁ STRANA ČECH A MORAVY","15/15","52,3","13%","7%","1",1,47
"ČESKÁ STRANA SOCIÁLNĚ DEMOKRATICKÁ","15/15","36,7","53%","13%","2",1,7
"ANO 2011","15/15","41,5","33%","27%","0",1,768
"SDRUŽENÍ NEZÁVISLÝCH KANDIDÁTŮ-KAROLINKA","15/15","40,2","33%","33%","2",1,901
