"Strana","Počet kandidátů","Mandát obhajuje","Změna strany","Nováčci","Průměrný věk","Podíl žen","Akademický titul","StranaNr"
"KŘESŤANSKÁ A DEMOKRATICKÁ UNIE - ČESKOSLOVENSKÁ STRANA LIDOVÁ","17/17","6",0,"6","47,6","35%","65%",1
"ČESKÁ STRANA NÁRODNĚ SOCIALISTICKÁ","17/17","0",12,"5","51,4","53%","65%",175
"ZELENÍ A NEZÁVISLÍ S PODPOROU PIRÁTŮ","10/17","0",5,"5","43,5","20%","80%",364
"SDRUŽENÍ KANDIDÁTŮ OBČANSKÉ DEMOKRATICKÉ STRANY A TOP 09","17/17","0",10,"7","52,5","29%","53%",687
"ČESKÁ STRANA SOCIÁLNĚ DEMOKRATICKÁ","17/17","5",1,"7","49,7","35%","53%",7
"NESTRANÍCI - SDRUŽENÍ NEZÁVISLÝCH KANDIDÁTŮ","17/17","0",4,"13","41,2","35%","53%",901
