"Strana","Počet kandidátů","Průměrný věk","Podíl žen","Akademický titul","Mandát obhajuje","Změna strany","StranaNr"
"ROBERT MAREK, NEZÁVISLÝ KANDIDÁT","1/7","35","0%","0%","1",0,801
"LADISLAV DVOŘÁK, NEZÁVISLÝ KANDIDÁT","1/7","37","0%","0%","1",0,802
"ING. KATEŘINA LESÁKOVÁ, NEZÁVISLÝ KANDIDÁT","1/7","41","100%","100%","0",0,803
"JANA VINŠOVÁ, NEZÁVISLÝ KANDIDÁT","1/7","34","100%","0%","1",0,804
"JAROSLAV ČEPELÍK, NEZÁVISLÝ KANDIDÁT","1/7","46","0%","0%","1",0,805
"IVA ŠVEC, NEZÁVISLÝ KANDIDÁT","1/7","45","0%","0%","0",0,806
"DAGMAR ŠRYTROVÁ, NEZÁVISLÝ KANDIDÁT","1/7","38","100%","100%","1",0,807
