"Strana","Počet kandidátů","Průměrný věk","Podíl žen","Akademický titul","Mandát obhajuje","Změna strany","StranaNr"
"PAVEL ŠOTT, NEZÁVISLÝ KANDIDÁT","1/5","33","0%","0%","0",0,801
"STANISLAV SALON, NEZÁVISLÝ KANDIDÁT","1/5","61","0%","0%","1",0,802
"PETR MÜLLER, NEZÁVISLÝ KANDIDÁT","1/5","46","0%","0%","0",0,803
"JIŘÍ FRÖHLICH, NEZÁVISLÝ KANDIDÁT","1/5","37","0%","0%","1",0,804
"KAREL ŽÁČEK, NEZÁVISLÝ KANDIDÁT","1/5","62","0%","0%","1",0,805
"MILAN HOFNER, NEZÁVISLÝ KANDIDÁT","1/5","71","0%","0%","1",0,806
"MARTINA VORÁLKOVÁ, NEZÁVISLÝ KANDIDÁT","1/5","39","100%","0%","0",0,807
"MARTIN STRNAD, NEZÁVISLÝ KANDIDÁT","1/5","40","0%","0%","0",0,808
