"Strana","Počet kandidátů","Průměrný věk","Podíl žen","Akademický titul","Mandát obhajuje","Změna strany","StranaNr"
"MILOSLAV TOMIŠKA, NEZÁVISLÝ KANDIDÁT","1/7","68","0%","0%","1",0,801
"MARTINA TOMČÍKOVÁ, NEZÁVISLÝ KANDIDÁT","1/7","28","100%","0%","0",0,802
"MGR. LADA VOJÁČKOVÁ, NEZÁVISLÝ KANDIDÁT","1/7","52","100%","100%","1",0,803
"EVA KUČEROVÁ, NEZÁVISLÝ KANDIDÁT","1/7","23","100%","0%","1",0,804
"MICHAELA HUDÁKOVÁ, NEZÁVISLÝ KANDIDÁT","1/7","32","100%","0%","0",0,805
"DAVID HOLUB, NEZÁVISLÝ KANDIDÁT","1/7","38","0%","0%","1",0,806
"ALEŠ MACH, NEZÁVISLÝ KANDIDÁT","1/7","40","0%","0%","0",0,807
"FRANTIŠEK JELÍNEK, NEZÁVISLÝ KANDIDÁT","1/7","54","0%","0%","1",0,808
"ING. JOSEF JEDLIČKA, NEZÁVISLÝ KANDIDÁT","1/7","45","0%","100%","0",0,809
