"Strana","Počet kandidátů","Průměrný věk","Podíl žen","Akademický titul","Mandát obhajuje","Změna strany","StranaNr"
"ING. IVA FRYDRYCHOVÁ, NEZÁVISLÝ KANDIDÁT","1/7","42","100%","100%","1",0,801
"PETRA BERNÁ, NEZÁVISLÝ KANDIDÁT","1/7","37","100%","0%","1",0,802
"MIROSLAV FRYDRYCH, NEZÁVISLÝ KANDIDÁT","1/7","49","0%","0%","1",0,803
"VLASTIMIL LIŠKA, NEZÁVISLÝ KANDIDÁT","1/7","50","0%","0%","1",0,804
"JITKA PAPPOVÁ, NEZÁVISLÝ KANDIDÁT","1/7","42","100%","0%","1",0,805
"JAROSLAV BERNÝ, NEZÁVISLÝ KANDIDÁT","1/7","39","0%","0%","1",0,806
"JOSEF KOUTNÍK, NEZÁVISLÝ KANDIDÁT","1/7","41","0%","0%","1",0,807
