"Strana","Počet kandidátů","Průměrný věk","Podíl žen","Akademický titul","Mandát obhajuje","Změna strany","StranaNr"
"MILOŠ MAŠEK, NEZÁVISLÝ KANDIDÁT","1/9","23","0%","0%","1",0,801
"ING. KAREL CHALUPNÝ, NEZÁVISLÝ KANDIDÁT","1/9","60","0%","100%","0",0,802
"PAVEL KOSÍK, NEZÁVISLÝ KANDIDÁT","1/9","56","0%","0%","0",0,803
"VÁCLAV PTÁČEK, NEZÁVISLÝ KANDIDÁT","1/9","40","0%","0%","1",0,804
"LUBOŠ KUBEŠ, NEZÁVISLÝ KANDIDÁT","1/9","49","0%","0%","1",0,805
"PETR KŘÍŽ, NEZÁVISLÝ KANDIDÁT","1/9","35","0%","0%","0",0,806
"RICHARD KOŠKA, NEZÁVISLÝ KANDIDÁT","1/9","43","0%","0%","0",0,807
"ING. VÁCLAV ŽÁK, NEZÁVISLÝ KANDIDÁT","1/9","47","0%","100%","1",0,808
"MIROSLAV RŮŽIČKA, NEZÁVISLÝ KANDIDÁT","1/9","52","0%","0%","1",0,809
