"Strana","Počet kandidátů","Průměrný věk","Podíl žen","Akademický titul","Mandát obhajuje","Změna strany","StranaNr"
"KOMUNISTICKÁ STRANA ČECH A MORAVY","6/7","52,5","0%","0%","1",0,47
"ANO 2011","7/7","51,3","43%","57%","0",2,768
"ZMĚNA 2014","8/7","40,2","25%","25%","1",0,901
"ZA ROZVOJ A UDRŽENÍ KULTURY A TRADIC V OBCI KTIŠ","9/7","34,9","78%","22%","4",0,902
"ZA HOSPODÁŘSKÝ ROZVOJ OBCE KTIŠ A JEJÍCH OSAD","9/7","46,7","56%","0%","0",1,903
"ŠANCE PRO KTIŠ A OKOLÍ 2014","7/7","43,3","0%","0%","0",0,904
