"Strana","Počet kandidátů","Průměrný věk","Podíl žen","Akademický titul","Mandát obhajuje","Změna strany","StranaNr"
"KŘESŤANSKÁ A DEMOKRATICKÁ UNIE - ČESKOSLOVENSKÁ STRANA LIDOVÁ","15/15","42,7","47%","27%","4",1,1
"SDRUŽENÍ NEZÁVISLÝCH KANDIDÁTŮ A OBČANSKÉ DEMOKRATICKÉ STRANY","15/15","35,2","47%","0%","0",3,389
"ČESKÁ STRANA SOCIÁLNĚ DEMOKRATICKÁ","15/15","45,1","27%","13%","3",0,7
"RUDOLF PĚRŠALA, NEZÁVISLÝ KANDIDÁT","1/15","59","0%","100%","0",0,801
"JOSEF HRDINA, NEZÁVISLÝ KANDIDÁT","1/15","66","0%","0%","0",0,802
"""SDRUŽENÍ NEZÁVISLÝCH KANDIDÁTŮ HOLUBIC""","15/15","45,2","60%","33%","5",0,901
