"Strana","Počet kandidátů","Mandát obhajuje","Změna strany","Nováčci","Průměrný věk","Podíl žen","Akademický titul","StranaNr"
"PETR MIKOLÁŠ, NEZÁVISLÝ KANDIDÁT","1/7","0",0,"0","49","0%","0%",801
"JAROMÍR HONSA, NEZÁVISLÝ KANDIDÁT","1/7","1",0,"0","44","0%","0%",802
"MARTIN ROMAN, NEZÁVISLÝ KANDIDÁT","1/7","1",0,"0","37","0%","0%",803
"KAREL TOMANDL, NEZÁVISLÝ KANDIDÁT","1/7","1",0,"0","42","0%","0%",804
"ING. MARTIN KUBÍČEK, NEZÁVISLÝ KANDIDÁT","1/7","0",1,"0","26","0%","100%",805
"HANA BURIANOVÁ, NEZÁVISLÝ KANDIDÁT","1/7","0",0,"0","46","100%","0%",806
"ING. PAVLA ZAHRÁDKOVÁ, NEZÁVISLÝ KANDIDÁT","1/7","0",1,"0","29","100%","100%",807
"LADISLAVA ŠONKOVÁ, NEZÁVISLÝ KANDIDÁT","1/7","1",0,"0","42","100%","0%",808
"JIŘÍ HRUŠKA, NEZÁVISLÝ KANDIDÁT","1/7","1",0,"0","42","0%","0%",809
