"Strana","Počet kandidátů","Průměrný věk","Podíl žen","Akademický titul","Mandát obhajuje","Změna strany","StranaNr"
"KŘESŤANSKÁ A DEMOKRATICKÁ UNIE - ČESKOSLOVENSKÁ STRANA LIDOVÁ","9/9","50,7","56%","44%","4",0,1
"STRANA PRO OTEVŘENOU SPOLEČNOST","9/9","43,3","0%","11%","0",0,103
"NESTRANÍCI","9/9","44,4","33%","44%","0",5,181
"ČESKÁ STRANA SOCIÁLNĚ DEMOKRATICKÁ","9/9","50,4","22%","44%","1",0,7
"SDRUŽENÍ NEZÁVISLÝCH KANDIDÁTŮ VOLBY 2014","9/9","51","33%","22%","3",0,901
"NEZÁVISLÍ ČERVENCE","9/9","40,7","44%","22%","0",5,902
