"Strana","Počet kandidátů","Průměrný věk","Podíl žen","Akademický titul","Mandát obhajuje","Změna strany","StranaNr"
"ROMAN KOUBEK, NEZÁVISLÝ KANDIDÁT","1/7","46","0%","0%","1",0,801
"VĚRA URBANOVÁ, NEZÁVISLÝ KANDIDÁT","1/7","58","100%","0%","1",0,802
"FRANTIŠEK SVOBODA, NEZÁVISLÝ KANDIDÁT","1/7","31","0%","0%","1",0,803
"MILAN MAREŠ, NEZÁVISLÝ KANDIDÁT","1/7","70","0%","0%","1",0,804
"JOSEF BĚLOHLAV, NEZÁVISLÝ KANDIDÁT","1/7","46","0%","0%","1",0,805
"MAREK ČERNÝ, NEZÁVISLÝ KANDIDÁT","1/7","41","0%","0%","0",0,806
"JAN MUSEL, NEZÁVISLÝ KANDIDÁT","1/7","28","0%","0%","1",0,807
"LADISLAV MUSEL, NEZÁVISLÝ KANDIDÁT","1/7","29","0%","0%","1",0,808
