"Strana","Počet kandidátů","Průměrný věk","Podíl žen","Akademický titul","Mandát obhajuje","Změna strany","StranaNr"
"TOMÁŠ BÁLEK, NEZÁVISLÝ KANDIDÁT","1/7","46","0%","0%","0",0,801
"JAROSLAV NAVRÁTIL, NEZÁVISLÝ KANDIDÁT","1/7","40","0%","0%","1",0,802
"JIŘÍ SAMEC, NEZÁVISLÝ KANDIDÁT","1/7","41","0%","0%","1",0,803
"LUBOŠ OULICKÝ, NEZÁVISLÝ KANDIDÁT","1/7","29","0%","0%","1",0,804
"LEOŠ SEJK, NEZÁVISLÝ KANDIDÁT","1/7","37","0%","0%","0",0,805
"PAVLA DOLEŽALOVÁ, NEZÁVISLÝ KANDIDÁT","1/7","38","100%","0%","1",0,806
"STANISLAV NOVOTNÝ, NEZÁVISLÝ KANDIDÁT","1/7","40","0%","0%","0",0,807
"MGR. JULIE PEŠKOVÁ, NEZÁVISLÝ KANDIDÁT","1/7","38","100%","100%","0",0,808
