"Strana","Počet kandidátů","Průměrný věk","Podíl žen","Akademický titul","Mandát obhajuje","Změna strany","StranaNr"
"VOLBA PRO MĚSTO HORŠOVSKÝ TÝN A NEZÁVISLÍ KANDIDÁTI","17/17","46,5","29%","47%","3",1,411
"KOMUNISTICKÁ STRANA ČECH A MORAVY","17/17","62,1","24%","12%","3",0,47
"SDRUŽENÍ NEZÁVISLÝCH KANDIDÁTŮ PRO HORŠOVSKÝ TÝN","17/17","44,1","6%","6%","0",1,470
"DEMOKRATICKÁ STRANA ZELENÝCH A NEZÁVISLÍ KANDIDÁTI - SDRUŽENÍ DSZ A NK","5/17","44,6","80%","0%","0",2,482
"OBČANSKÁ DEMOKRATICKÁ STRANA","17/17","50,7","6%","24%","4",0,53
"ČESKÁ STRANA SOCIÁLNĚ DEMOKRATICKÁ","17/17","51,8","29%","41%","3",0,7
"NEZÁVISLÍ HORŠOVSKÝ TÝN","17/17","39,3","18%","35%","0",0,901
