"Strana","Počet kandidátů","Průměrný věk","Podíl žen","Akademický titul","Mandát obhajuje","Změna strany","StranaNr"
"KOMUNISTICKÁ STRANA ČECH A MORAVY","15/15","65,3","47%","7%","2",0,47
"SDRUŽENÍ PRO OTEVŘENOU SPOLEČNOST","15/15","46,5","27%","53%","0",11,470
"DEMOKRATICKÁ STRANA ZELENÝCH A NEZÁVISLÍ KANDIDÁTI - SDRUŽENÍ DSZ A NK","4/15","56,2","50%","25%","0",2,482
"OBČANSKÁ DEMOKRATICKÁ STRANA","15/15","37,9","47%","20%","5",0,53
"ČESKÁ STRANA SOCIÁLNĚ DEMOKRATICKÁ","15/15","48,5","40%","40%","2",0,7
"ANO 2011","15/15","39,8","20%","47%","0",1,768
