"Strana","Počet kandidátů","Mandát obhajuje","Změna strany","Nováčci","Průměrný věk","Podíl žen","Akademický titul","StranaNr"
"KŘESŤANSKÁ A DEMOKRATICKÁ UNIE - ČESKOSLOVENSKÁ STRANA LIDOVÁ A NEZÁVISLÍ KANDIDÁTI","15/15","5",0,"2","52","40%","33%",1
"KOMUNISTICKÁ STRANA ČECH A MORAVY","15/15","2",0,"9","47,4","53%","13%",47
"OBČANSKÁ DEMOKRATICKÁ STRANA","15/15","4",0,"4","48,3","47%","67%",53
"ČESKÁ STRANA SOCIÁLNĚ DEMOKRATICKÁ","15/15","4",0,"7","49,5","33%","33%",7
"STRANA SVOBODNÝCH OBČANŮ","8/15","0",0,"0","32,5","38%","12%",714
