"Strana","Počet kandidátů","Průměrný věk","Podíl žen","Akademický titul","Mandát obhajuje","Změna strany","StranaNr"
"PAVEL MRÁZ, NEZÁVISLÝ KANDIDÁT","1/7","41","0%","0%","0",0,801
"JAN KABOUREK, NEZÁVISLÝ KANDIDÁT","1/7","40","0%","0%","0",0,802
"MARTIN ČADEK, NEZÁVISLÝ KANDIDÁT","1/7","39","0%","0%","0",0,803
"ELIŠKA VRBOVÁ, NEZÁVISLÝ KANDIDÁT","1/7","34","100%","0%","0",0,804
"ING. LUDĚK KUNÍK, NEZÁVISLÝ KANDIDÁT","1/7","49","0%","100%","0",0,805
"NIKOLA KINZLEROVÁ, NEZÁVISLÝ KANDIDÁT","1/7","38","100%","0%","0",0,806
"LUBOMÍR MLEZIVA, NEZÁVISLÝ KANDIDÁT","1/7","57","0%","0%","0",0,807
"VÁCLAV PODSKLAN, NEZÁVISLÝ KANDIDÁT","1/7","34","0%","0%","0",0,808
