"Strana","Počet kandidátů","Průměrný věk","Podíl žen","Akademický titul","Mandát obhajuje","Změna strany","StranaNr"
"DĚLNICKÁ STRANA SOCIÁLNÍ SPRAVEDLNOSTI - ZA BEZPEČNÝ CHODOV!","1/21","35","0%","0%","0",0,1072
"HNUTÍ NEZÁVISLÝCH ZA HARMONICKÝ ROZVOJ OBCÍ A MĚST","21/21","48,6","33%","43%","8",0,112
"UNIE PRO SPORT A ZDRAVÍ","21/21","41,4","38%","29%","0",5,119
"KOMUNISTICKÁ STRANA ČECH A MORAVY","9/21","60,8","33%","0%","2",0,47
"OBČANSKÁ DEMOKRATICKÁ STRANA","21/21","51,2","38%","14%","2",0,53
"ČESKÁ STRANA SOCIÁLNĚ DEMOKRATICKÁ","21/21","49,6","52%","14%","3",0,7
"STRANA SOUKROMNÍKŮ ČESKÉ REPUBLIKY","16/21","42,2","44%","12%","1",1,716
"TOP 09","21/21","41,5","43%","29%","1",3,721
