"Strana","Počet kandidátů","Průměrný věk","Podíl žen","Akademický titul","Mandát obhajuje","Změna strany","StranaNr"
"JAN ŽIROVNICKÝ, NEZÁVISLÝ KANDIDÁT","1/7","39","0%","0%","1",0,801
"PETR MEJDRECH, NEZÁVISLÝ KANDIDÁT","1/7","43","0%","0%","0",0,802
"PAVEL ČECHTICKÝ, NEZÁVISLÝ KANDIDÁT","1/7","41","0%","0%","0",0,803
"FRANTIŠEK BÁRTA, NEZÁVISLÝ KANDIDÁT","1/7","39","0%","0%","0",0,804
"JOSEF JÍROVEC, NEZÁVISLÝ KANDIDÁT","1/7","66","0%","0%","0",0,805
"TOMÁŠ PETŘÍČEK, NEZÁVISLÝ KANDIDÁT","1/7","27","0%","0%","0",0,806
"LUKÁŠ KAZDA, NEZÁVISLÝ KANDIDÁT","1/7","31","0%","0%","0",0,807
"KAREL KUPKA, NEZÁVISLÝ KANDIDÁT","1/7","33","0%","0%","0",0,808
"JOSEF KUPKA, NEZÁVISLÝ KANDIDÁT","1/7","59","0%","0%","0",0,809
