"Strana","Počet kandidátů","Průměrný věk","Podíl žen","Akademický titul","Mandát obhajuje","Změna strany","StranaNr"
"JIŘÍ DVOŘÁK, NEZÁVISLÝ KANDIDÁT","1/7","41","0%","0%","1",0,801
"JIŘÍ ŠULC, NEZÁVISLÝ KANDIDÁT","1/7","45","0%","0%","1",0,802
"VLADIMÍR HRUBÝ, NEZÁVISLÝ KANDIDÁT","1/7","36","0%","0%","0",0,803
"ZDENĚK KOS, NEZÁVISLÝ KANDIDÁT","1/7","51","0%","0%","1",0,804
"ANTONÍN BÁRTA, NEZÁVISLÝ KANDIDÁT","1/7","52","0%","0%","1",0,805
"JIŘÍ RŮŽEK, NEZÁVISLÝ KANDIDÁT","1/7","47","0%","0%","0",0,806
"DAVID ZENÁHLÍK, NEZÁVISLÝ KANDIDÁT","1/7","26","0%","100%","0",0,807
"JAROSLAV ŠUSTR, NEZÁVISLÝ KANDIDÁT","1/7","37","0%","0%","1",0,808
