"Strana","Počet kandidátů","Průměrný věk","Podíl žen","Akademický titul","Mandát obhajuje","Změna strany","StranaNr"
"VLADIMÍR VEJŠICKÝ, NEZÁVISLÝ KANDIDÁT","1/7","49","0%","0%","1",0,801
"ING. JARMILA KOLÁŘOVÁ, NEZÁVISLÝ KANDIDÁT","1/7","62","100%","100%","1",0,802
"VLADIMÍR MACOUN, NEZÁVISLÝ KANDIDÁT","1/7","46","0%","0%","1",0,803
"ČESTMÍR MEZERA, NEZÁVISLÝ KANDIDÁT","1/7","57","0%","0%","1",0,804
"ZDENĚK TOUŠ, NEZÁVISLÝ KANDIDÁT","1/7","65","0%","0%","0",0,805
"ING. JAROSLAVA MACOUNOVÁ, NEZÁVISLÝ KANDIDÁT","1/7","49","100%","100%","1",0,806
"JOSEF FELBÁB, NEZÁVISLÝ KANDIDÁT","1/7","57","0%","0%","1",0,807
"RADIM KOLÁŘ, NEZÁVISLÝ KANDIDÁT","1/7","39","0%","0%","1",0,808
