"Strana","Počet kandidátů","Průměrný věk","Podíl žen","Akademický titul","Mandát obhajuje","Změna strany","StranaNr"
"JOSEF TOMEK, NEZÁVISLÝ KANDIDÁT","1/7","59","0%","0%","0",0,801
"MARTINA DVOŘÁKOVÁ, NEZÁVISLÝ KANDIDÁT","1/7","40","100%","0%","0",0,802
"VÁCLAV DRDA, NEZÁVISLÝ KANDIDÁT","1/7","52","0%","0%","1",0,803
"JAROSLAV SLANINA, NEZÁVISLÝ KANDIDÁT","1/7","36","0%","0%","1",0,804
"JAROSLAV FÁBER, NEZÁVISLÝ KANDIDÁT","1/7","68","0%","0%","1",0,805
"JOSEF DRDA, NEZÁVISLÝ KANDIDÁT","1/7","25","0%","0%","1",0,806
"PŘEMYSL DOLÍNEK, NEZÁVISLÝ KANDIDÁT","1/7","36","0%","0%","1",0,807
"ING. VĚROSLAV HRUBÝ, NEZÁVISLÝ KANDIDÁT","1/7","60","0%","100%","0",0,808
"ALENA KYRYANOVÁ, NEZÁVISLÝ KANDIDÁT","1/7","22","100%","0%","0",0,809
