"Strana","Počet kandidátů","Průměrný věk","Podíl žen","Akademický titul","Mandát obhajuje","Změna strany","StranaNr"
"ING. PETR TRACHTA, NEZÁVISLÝ KANDIDÁT","1/7","42","0%","100%","1",0,801
"VĚRA HRADECKÁ, NEZÁVISLÝ KANDIDÁT","1/7","67","100%","0%","1",0,802
"FRANTIŠEK BAYER, NEZÁVISLÝ KANDIDÁT","1/7","55","0%","0%","1",0,803
"JANA SVÍTKOVÁ, NEZÁVISLÝ KANDIDÁT","1/7","41","100%","0%","1",0,804
"JANA ŠALOUNOVÁ, NEZÁVISLÝ KANDIDÁT","1/7","28","100%","0%","1",0,805
"JUDR. VLADIMÍR TRNKA, NEZÁVISLÝ KANDIDÁT","1/7","60","0%","100%","1",0,806
"JIŘÍ HOFFMANN, NEZÁVISLÝ KANDIDÁT","1/7","34","0%","0%","1",0,807
