"Strana","Počet kandidátů","Mandát obhajuje","Změna strany","Nováčci","Průměrný věk","Podíl žen","Akademický titul","StranaNr"
"KOMUNISTICKÁ STRANA ČECH A MORAVY","13/13","2",0,"3","62,2","31%","31%",47
"""ZA KRYRY A OBCE STROJETICE, STEBNO A BĚSNO KRÁSNĚJŠÍ""","13/13","0",9,"4","53,9","38%","46%",470
"MOJE KRYRY","13/13","0",7,"6","39,6","8%","15%",480
"ZA PROSPERITU OBCÍ A BUDOUCNOST NAŠICH DĚTÍ","13/13","0",9,"4","47,2","54%","23%",483
"OBČANSKÁ DEMOKRATICKÁ STRANA","13/13","2",1,"6","46,8","15%","15%",53
"ČESKÁ STRANA SOCIÁLNĚ DEMOKRATICKÁ","13/13","0",1,"12","40,8","31%","38%",7
"ZA KRYRY A OBCE STROJETICE, STEBNO A BĚSNO BOHATŠÍ.","13/13","0",8,"5","45,8","38%","15%",901
