"Strana","Počet kandidátů","Průměrný věk","Podíl žen","Akademický titul","Mandát obhajuje","Změna strany","StranaNr"
"KOMUNISTICKÁ STRANA ČECH A MORAVY","6/9","63,8","83%","17%","1",0,47
"ČESKÁ STRANA SOCIÁLNĚ DEMOKRATICKÁ","9/9","48,6","67%","0%","2",2,7
"SNK - ROZVOJ NAŠICH OBCÍ","9/9","44,8","100%","67%","2",1,901
"SDRUŽENÍ NEZÁVISLÝCH KANDIDÁTŮ KRÁSNÝ DVŮR","9/9","51","11%","33%","2",0,902
"NEZÁVISLÝ BLOK","9/9","54,2","11%","0%","1",0,903
"HASIČI PRO KRÁSNÝ DVŮR LEPŠÍ","9/9","48,6","22%","0%","0",1,904
