"Strana","Počet kandidátů","Průměrný věk","Podíl žen","Akademický titul","Mandát obhajuje","Změna strany","StranaNr"
"MARTIN HOFMAN, NEZÁVISLÝ KANDIDÁT","1/7","20","0%","0%","1",0,801
"PAVEL GRŰNER, NEZÁVISLÝ KANDIDÁT","1/7","41","0%","0%","1",0,802
"LADISLAV JELÍNEK, NEZÁVISLÝ KANDIDÁT","1/7","39","0%","0%","0",0,803
"ROMAN MAJER, NEZÁVISLÝ KANDIDÁT","1/7","48","0%","0%","0",0,804
"TEREZA MAJEROVÁ, NEZÁVISLÝ KANDIDÁT","1/7","24","100%","0%","1",0,805
"LUBOŠ MAREK, NEZÁVISLÝ KANDIDÁT","1/7","52","0%","0%","1",0,806
"MARTINA MARKOVÁ, NEZÁVISLÝ KANDIDÁT","1/7","47","100%","0%","1",0,807
"MILAN ŠKOPEK, NEZÁVISLÝ KANDIDÁT","1/7","32","0%","0%","1",0,808
"JIŘÍ VOLDŘICH, NEZÁVISLÝ KANDIDÁT","1/7","35","0%","0%","0",0,809
