"Strana","Počet kandidátů","Mandát obhajuje","Změna strany","Nováčci","Průměrný věk","Podíl žen","Akademický titul","StranaNr"
"MARTIN HOFMAN, NEZÁVISLÝ KANDIDÁT","1/7","0",0,"0","20","0%","0%",801
"PAVEL GRŰNER, NEZÁVISLÝ KANDIDÁT","1/7","0",0,"0","41","0%","0%",802
"LADISLAV JELÍNEK, NEZÁVISLÝ KANDIDÁT","1/7","0",1,"0","39","0%","0%",803
"ROMAN MAJER, NEZÁVISLÝ KANDIDÁT","1/7","0",1,"0","48","0%","0%",804
"TEREZA MAJEROVÁ, NEZÁVISLÝ KANDIDÁT","1/7","0",0,"0","24","100%","0%",805
"LUBOŠ MAREK, NEZÁVISLÝ KANDIDÁT","1/7","0",1,"0","52","0%","0%",806
"MARTINA MARKOVÁ, NEZÁVISLÝ KANDIDÁT","1/7","0",0,"0","47","100%","0%",807
"MILAN ŠKOPEK, NEZÁVISLÝ KANDIDÁT","1/7","0",0,"0","32","0%","0%",808
"JIŘÍ VOLDŘICH, NEZÁVISLÝ KANDIDÁT","1/7","0",0,"0","35","0%","0%",809
