"Strana","Počet kandidátů","Mandát obhajuje","Změna strany","Nováčci","Průměrný věk","Podíl žen","Akademický titul","StranaNr"
"KŘESŤANSKÁ A DEMOKRATICKÁ UNIE - ČESKOSLOVENSKÁ STRANA LIDOVÁ","2/7","2",0,"0","38","50%","0%",1
"ČESKÁ STRANA SOCIÁLNĚ DEMOKRATICKÁ","2/7","0",0,"0","45,5","50%","0%",7
"MARCELA BARTONÍČKOVÁ, NEZÁVISLÝ KANDIDÁT","1/7","0",0,"0","40","100%","0%",801
"VÁCLAV DANIEL, NEZÁVISLÝ KANDIDÁT","1/7","1",0,"0","42","0%","0%",802
"MIROSLAV TOMAS, NEZÁVISLÝ KANDIDÁT","1/7","0",0,"0","31","0%","0%",803
"MARTINA SOMMEROVÁ, NEZÁVISLÝ KANDIDÁT","1/7","0",0,"0","38","100%","0%",804
"STANISLAV CVIK, NEZÁVISLÝ KANDIDÁT","1/7","0",0,"0","49","0%","0%",805
"MILOSLAV PETR, NEZÁVISLÝ KANDIDÁT","1/7","1",0,"0","51","0%","0%",806
"BOHUSLAV ZYCH, NEZÁVISLÝ KANDIDÁT","1/7","1",0,"0","52","0%","0%",807
