"Strana","Počet kandidátů","Mandát obhajuje","Změna strany","Nováčci","Průměrný věk","Podíl žen","Akademický titul","StranaNr"
"KDU-ČSL A NEZÁVISLÍ KANDIDÁTI","21/21","4",0,"6","44,8","29%","48%",355
"KOMUNISTICKÁ STRANA ČECH A MORAVY","21/21","4",0,"5","58,6","33%","0%",47
"ODS A TOP 09","21/21","0",11,"10","46,6","38%","33%",687
"ČESKÁ STRANA SOCIÁLNĚ DEMOKRATICKÁ","21/21","3",2,"8","48,7","33%","38%",7
"NEZÁVISLÍ","21/21","4",3,"2","52,6","29%","52%",88
"P R O   SVĚTELSKO","21/21","0",6,"15","45,9","57%","43%",901
