"Strana","Počet kandidátů","Mandát obhajuje","Změna strany","Nováčci","Průměrný věk","Podíl žen","Akademický titul","StranaNr"
"KŘESŤANSKÁ A DEMOKRATICKÁ UNIE - ČESKOSLOVENSKÁ STRANA LIDOVÁ","11/11","0",0,"0","38,9","45%","9%",1
"KOMUNISTICKÁ STRANA ČECH A MORAVY","11/11","1",0,"3","65,4","45%","9%",47
"OBEC PRO OBČANY","11/11","0",3,"8","39,3","55%","27%",480
"SDRUŽENÍ NEZÁVISLÝCH KANDIDÁTŮ VĚŽ I.","11/11","1",0,"3","46,1","100%","27%",901
"SDRUŽENÍ NEZÁVISLÝCH KANDIDÁTŮ JEDOUCHOV","11/11","1",0,"1","54","9%","0%",902
"SDRUŽENÍ NEZÁVISLÝCH KANDIDÁTŮ-SKÁLA","11/11","0",8,"3","38,1","36%","45%",903
"SDRUŽENÍ NEZÁVISLÝCH KANDIDÁTŮ-VĚŽ II","11/11","0",8,"3","32,2","0%","18%",904
"SDRUŽENÍ NEZÁVISLÝCH KANDIDÁTŮ VĚŽ III.","11/11","0",3,"8","37,7","18%","27%",905
"SDRUŽENÍ NEZÁVISLÝCH KANDIDÁTŮ LEŠTINA","11/11","2",0,"7","37,2","55%","18%",906
