"Strana","Počet kandidátů","Průměrný věk","Podíl žen","Akademický titul","Mandát obhajuje","Změna strany","StranaNr"
"MICHAL HUŠEK, NEZÁVISLÝ KANDIDÁT","1/7","40","0%","0%","0",0,801
"LIBOR MACHEK, NEZÁVISLÝ KANDIDÁT","1/7","27","0%","0%","1",0,802
"TOMÁŠ MALÝ, NEZÁVISLÝ KANDIDÁT","1/7","40","0%","0%","1",0,803
"MARCEL MOUČEK, NEZÁVISLÝ KANDIDÁT","1/7","41","0%","0%","1",0,804
"MILAN POLÁK, NEZÁVISLÝ KANDIDÁT","1/7","35","0%","0%","1",0,805
"MILAN SLOVÁK, NEZÁVISLÝ KANDIDÁT","1/7","27","0%","0%","1",0,806
"MILAN SLOVÁK, NEZÁVISLÝ KANDIDÁT","1/7","56","0%","0%","0",0,807
"PAVEL STAFFA, NEZÁVISLÝ KANDIDÁT","1/7","38","0%","0%","0",0,808
