"Strana","Počet kandidátů","Průměrný věk","Podíl žen","Akademický titul","Mandát obhajuje","Změna strany","StranaNr"
"VÁCLAV ŠULC, NEZÁVISLÝ KANDIDÁT","1/5","39","0%","0%","0",1,801
"PAVEL MRŇAVÝ, NEZÁVISLÝ KANDIDÁT","1/5","41","0%","0%","0",1,802
"VÁCLAV KELLNER, NEZÁVISLÝ KANDIDÁT","1/5","56","0%","0%","0",0,803
"ING. JOSEF ELIÁŠ, NEZÁVISLÝ KANDIDÁT","1/5","51","0%","100%","0",1,804
"LADISLAVA ELIÁŠOVÁ, NEZÁVISLÝ KANDIDÁT","1/5","43","100%","0%","0",1,805
"GEJZA HORVÁTH, NEZÁVISLÝ KANDIDÁT","1/5","43","0%","0%","0",1,806
