"Strana","Počet kandidátů","Průměrný věk","Podíl žen","Akademický titul","Mandát obhajuje","Změna strany","StranaNr"
"KŘESŤANSKÁ A DEMOKRATICKÁ UNIE - ČESKOSLOVENSKÁ STRANA LIDOVÁ","12/15","52,4","75%","17%","0",0,1
"KOMUNISTICKÁ STRANA ČECH A MORAVY","15/15","51,5","53%","20%","4",1,47
"DEJME ŠANCI RONOVU","15/15","42,9","0%","33%","0",0,470
"ČESKÁ STRANA SOCIÁLNĚ DEMOKRATICKÁ","15/15","50,9","0%","13%","2",0,7
"ANO 2011","15/15","45","13%","20%","0",3,768
"SDRUŽENÍ PRO ROZVOJ RONOVA, MLADOTIC A MORAVAN","15/15","39,5","13%","33%","5",0,901
