"Strana","Počet kandidátů","Průměrný věk","Podíl žen","Akademický titul","Mandát obhajuje","Změna strany","StranaNr"
"RADKA LANDOVSKÁ, NEZÁVISLÝ KANDIDÁT","1/7","36","100%","0%","1",0,801
"VĚRA RICHTEROVÁ, NEZÁVISLÝ KANDIDÁT","1/7","67","100%","0%","1",0,802
"ZDEŇKA RICHTEROVÁ, NEZÁVISLÝ KANDIDÁT","1/7","51","100%","0%","1",0,803
"MIROSLAV FRYDRYCH, NEZÁVISLÝ KANDIDÁT","1/7","42","0%","0%","1",0,804
"MILOSLAV ENGE, NEZÁVISLÝ KANDIDÁT","1/7","40","0%","0%","1",0,805
"JIŘÍ RICHTER, NEZÁVISLÝ KANDIDÁT","1/7","72","0%","0%","1",0,806
"ZDEŇKA BITTNEROVÁ, NEZÁVISLÝ KANDIDÁT","1/7","65","100%","0%","1",0,807
