"Strana","Počet kandidátů","Průměrný věk","Podíl žen","Akademický titul","Mandát obhajuje","Změna strany","StranaNr"
"ZDENĚK ŽALSKÝ, NEZÁVISLÝ KANDIDÁT","1/7","63","0%","0%","1",0,801
"JAROSLAVA PIVRNCOVÁ, NEZÁVISLÝ KANDIDÁT","1/7","53","100%","0%","0",0,802
"PETR STRYHAL, NEZÁVISLÝ KANDIDÁT","1/7","28","0%","0%","1",0,803
"ŽANETA KARBANOVÁ, NEZÁVISLÝ KANDIDÁT","1/7","25","100%","0%","0",0,804
"VLADIMÍR KOŠÍČEK, NEZÁVISLÝ KANDIDÁT","1/7","57","0%","0%","1",0,805
"JIŘÍ LOUMA, NEZÁVISLÝ KANDIDÁT","1/7","64","0%","0%","1",0,806
"MILOŠ POSPÍŠIL, NEZÁVISLÝ KANDIDÁT","1/7","25","0%","0%","1",0,807
"ZDENĚK KRÁL, NEZÁVISLÝ KANDIDÁT","1/7","50","0%","0%","1",0,808
