"Strana","Počet kandidátů","Mandát obhajuje","Změna strany","Nováčci","Průměrný věk","Podíl žen","Akademický titul","StranaNr"
"KŘESŤANSKÁ A DEMOKRATICKÁ UNIE - ČESKOSLOVENSKÁ STRANA LIDOVÁ","9/9","1",0,"6","47,2","56%","56%",1
"SDRUŽENÍ OBČANSKÉ DEMOKRATICKÉ STRANY A NEZÁVISLÝCH KANDIDÁTŮ","9/9","0",6,"3","43","44%","22%",389
"KOMUNISTICKÁ STRANA ČECH A MORAVY","9/9","1",1,"3","64,8","11%","0%",47
"ČESKÁ STRANA SOCIÁLNĚ DEMOKRATICKÁ","9/9","0",0,"0","55,6","67%","11%",7
"SBOR DOBROVOLNÝCH HASIČŮ","9/9","1",0,"5","44,7","11%","11%",901
"TJ SOKOL STARÁ PAKA","9/9","0",2,"7","51,9","22%","22%",902
