"Strana","Počet kandidátů","Průměrný věk","Podíl žen","Akademický titul","Mandát obhajuje","Změna strany","StranaNr"
"MILOŠ KRATĚNA, NEZÁVISLÝ KANDIDÁT","1/7","28","0%","0%","1",0,801
"KAMIL VLÁŠEK, NEZÁVISLÝ KANDIDÁT","1/7","36","0%","0%","0",0,802
"JOSEF HLÁVKO, NEZÁVISLÝ KANDIDÁT","1/7","43","0%","0%","1",0,803
"MILENA VALÁŠKOVÁ, NEZÁVISLÝ KANDIDÁT","1/7","42","100%","0%","0",0,804
"STANISLAVA TUPCOVÁ, NEZÁVISLÝ KANDIDÁT","1/7","40","100%","0%","1",0,805
"VLADIMÍR KOTYZA, NEZÁVISLÝ KANDIDÁT","1/7","53","0%","0%","1",0,806
"MARTIN DUCHÁČ, NEZÁVISLÝ KANDIDÁT","1/7","39","0%","0%","1",0,807
"MILENA ZÁKRAVSKÁ, NEZÁVISLÝ KANDIDÁT","1/7","56","100%","0%","1",0,808
"RADEK HLÁVKO, NEZÁVISLÝ KANDIDÁT","1/7","31","0%","0%","1",0,809
