"Strana","Počet kandidátů","Průměrný věk","Podíl žen","Akademický titul","Mandát obhajuje","Změna strany","StranaNr"
"JAROMÍR URBAN, NEZÁVISLÝ KANDIDÁT","1/7","45","0%","0%","0",0,801
"MILOŠ STEKLÝ, NEZÁVISLÝ KANDIDÁT","1/7","39","0%","0%","1",0,802
"JAN DOLANSKÝ, NEZÁVISLÝ KANDIDÁT","1/7","37","0%","0%","1",0,803
"PAVEL HYVL, NEZÁVISLÝ KANDIDÁT","1/7","52","0%","0%","0",0,804
"LUKÁŠ VOJTÍŠEK, NEZÁVISLÝ KANDIDÁT","1/7","34","0%","0%","1",0,805
"MIROSLAV NOVÁK, NEZÁVISLÝ KANDIDÁT","1/7","40","0%","0%","0",0,806
"JIŘÍ KROJIDLO, NEZÁVISLÝ KANDIDÁT","1/7","62","0%","0%","1",0,807
"MILUŠE VOJTÍŠKOVÁ, NEZÁVISLÝ KANDIDÁT","1/7","53","100%","0%","1",0,808
"BC. VÍT DERNER, NEZÁVISLÝ KANDIDÁT","1/7","42","0%","100%","1",0,809
