"Strana","Počet kandidátů","Mandát obhajuje","Změna strany","Nováčci","Průměrný věk","Podíl žen","Akademický titul","StranaNr"
"KOMUNISTICKÁ STRANA ČECH A MORAVY","15/15","1",2,"5","51,1","40%","0%",47
"ČESKÁ STRANA SOCIÁLNĚ DEMOKRATICKÁ","15/15","1",4,"6","49,8","53%","13%",7
"NEZÁVISLÍ BRNĚNEC II","15/15","0",5,"10","43,7","40%","13%",901
"NEZÁVISLÍ BRNĚNEC I","15/15","0",9,"6","43,1","47%","7%",902
"ŽENY PRO OBEC BRNĚNEC","12/15","0",2,"10","48,8","100%","8%",903
"SDRUŽENÍ KANDIDÁTŮ PRO OBČANY I","15/15","5",2,"5","50,1","33%","33%",904
"SDRUŽENÍ KANDIDÁTŮ PRO OBČANY II","15/15","0",8,"7","47,3","27%","27%",905
