"Strana","Počet kandidátů","Průměrný věk","Podíl žen","Akademický titul","Mandát obhajuje","Změna strany","StranaNr"
"BOŽENA JANČÍKOVÁ, NEZÁVISLÝ KANDIDÁT","1/7","36","100%","0%","1",0,801
"PAVEL EDLMAN, NEZÁVISLÝ KANDIDÁT","1/7","38","0%","0%","0",0,802
"BOŘIVOJ BEDNÁŘ, NEZÁVISLÝ KANDIDÁT","1/7","65","0%","0%","1",0,803
"ZDENĚK HEGR, NEZÁVISLÝ KANDIDÁT","1/7","60","0%","0%","1",0,804
"VRATISLAV KRÁL, NEZÁVISLÝ KANDIDÁT","1/7","61","0%","0%","1",0,805
"ING. PAVEL MAREČEK, NEZÁVISLÝ KANDIDÁT","1/7","48","0%","100%","0",0,806
"JAN NOVOTNÝ, NEZÁVISLÝ KANDIDÁT","1/7","49","0%","0%","0",0,807
"VOJTĚCH PANUŠKA, NEZÁVISLÝ KANDIDÁT","1/7","42","0%","0%","0",0,808
"ANNA SCHAUEROVÁ, NEZÁVISLÝ KANDIDÁT","1/7","57","100%","0%","0",0,809
