"Strana","Počet kandidátů","Průměrný věk","Podíl žen","Akademický titul","Mandát obhajuje","Změna strany","StranaNr"
"NOVÁ SVOBODA","15/15","48,5","27%","33%","4",1,901
"MARŠOVÁCI A SVOBOĎÁCI","15/15","41,7","33%","20%","2",1,902
"SDRUŽENÍ PRO ROZVOJ KULTURY A SPORTU","15/15","47,5","20%","0%","2",1,903
"OBČANÉ SVOBODY A ODS","15/15","44,6","13%","33%","0",3,904
"SDRUŽENÍ PRO LEPŠÍ SVOBODU NAD ÚPOU","15/15","52,2","27%","13%","0",3,905
"PRO KULTURU A MLÁDEŽ","15/15","42,5","47%","13%","0",2,906
