"Strana","Počet kandidátů","Průměrný věk","Podíl žen","Akademický titul","Mandát obhajuje","Změna strany","StranaNr"
"KŘESŤANSKÁ A DEMOKRATICKÁ UNIE - ČESKOSLOVENSKÁ STRANA LIDOVÁ","27/27","40,4","26%","52%","2",0,1
"OBČANSKÁ DEMOKRATICKÁ STRANA S PODPOROU NEZÁVISLÝCH KANDIDÁTŮ","27/27","48,7","33%","48%","0",2,389
"SDRUŽENÍ NEZÁVISLÝCH KANDIDÁTŮ - OUŠŤÁCI","27/27","46,6","30%","56%","0",2,457
"KOMUNISTICKÁ STRANA ČECH A MORAVY","27/27","63","41%","15%","2",2,47
"NEZÁVISLÍ S PODPOROU TOP 09","27/27","43,6","30%","56%","0",10,480
"ČESKÁ STRANA SOCIÁLNĚ DEMOKRATICKÁ","27/27","56,7","26%","52%","6",0,7
"STRANA SOUKROMNÍKŮ ČESKÉ REPUBLIKY","14/27","42,6","21%","0%","0",0,716
"ÚSTÍ 2014","27/27","43,7","30%","48%","8",9,901
