"Strana","Počet kandidátů","Mandát obhajuje","Změna strany","Nováčci","Průměrný věk","Podíl žen","Akademický titul","StranaNr"
"KŘESŤANSKÁ A DEMOKRATICKÁ UNIE - ČESKOSLOVENSKÁ STRANA LIDOVÁ","15/15","3",0,"5","48,3","33%","47%",1
"KOMUNISTICKÁ STRANA ČECH A MORAVY","15/15","0",11,"4","57,7","53%","20%",47
"OBČANSKÁ DEMOKRATICKÁ STRANA","15/15","0",12,"3","52,3","33%","40%",53
"ČESKÁ STRANA SOCIÁLNĚ DEMOKRATICKÁ","15/15","3",0,"8","35,5","47%","20%",7
"TOP 09","15/15","1",0,"9","36,5","7%","40%",721
"NEZÁVISLÍ OBČANÉ ČERVENÉ VODY A PŘILEHLÝCH ČÁSTÍ","15/15","0",0,"0","38,8","33%","13%",901
