"Strana","Počet kandidátů","Průměrný věk","Podíl žen","Akademický titul","Mandát obhajuje","Změna strany","StranaNr"
"KŘESŤANSKÁ A DEMOKRATICKÁ UNIE - ČESKOSLOVENSKÁ STRANA LIDOVÁ","15/15","48,3","33%","47%","3",0,1
"KOMUNISTICKÁ STRANA ČECH A MORAVY","15/15","57,7","53%","20%","3",0,47
"OBČANSKÁ DEMOKRATICKÁ STRANA","15/15","52,3","33%","40%","5",0,53
"ČESKÁ STRANA SOCIÁLNĚ DEMOKRATICKÁ","15/15","35,5","47%","20%","3",0,7
"TOP 09","15/15","36,5","7%","40%","1",0,721
"NEZÁVISLÍ OBČANÉ ČERVENÉ VODY A PŘILEHLÝCH ČÁSTÍ","15/15","38,8","33%","13%","0",0,901
