"Strana","Počet kandidátů","Průměrný věk","Podíl žen","Akademický titul","Mandát obhajuje","Změna strany","StranaNr"
"PAVLÍNA ŠAFÁŘOVÁ, NEZÁVISLÝ KANDIDÁT","1/7","45","100%","0%","1",0,801
"JAN PLÍHAL, NEZÁVISLÝ KANDIDÁT","1/7","27","0%","0%","0",0,802
"MARIÁN DVOŘÁK, NEZÁVISLÝ KANDIDÁT","1/7","34","0%","0%","0",0,803
"LADISLAV HARAPÁT, NEZÁVISLÝ KANDIDÁT","1/7","54","0%","0%","1",0,804
"ING. MARIKA SVOBODOVÁ, NEZÁVISLÝ KANDIDÁT","1/7","29","100%","100%","0",0,805
"MARKÉTA HARAPÁTOVÁ, NEZÁVISLÝ KANDIDÁT","1/7","25","100%","0%","0",0,806
"ZDENĚK DOSKOČIL, NEZÁVISLÝ KANDIDÁT","1/7","35","0%","0%","1",0,807
"JIŘÍ VÍTEK, NEZÁVISLÝ KANDIDÁT","1/7","58","0%","0%","1",0,808
