"Strana","Počet kandidátů","Průměrný věk","Podíl žen","Akademický titul","Mandát obhajuje","Změna strany","StranaNr"
"KŘESŤANSKÁ A DEMOKRATICKÁ UNIE - ČESKOSLOVENSKÁ STRANA LIDOVÁ","21/21","49,5","33%","52%","3",4,1
"LETOHRAD 2014, NESTRANÍCI S PODPOROU ODS","21/21","43,9","29%","52%","0",8,389
"ZELENÁ PRO LETOHRAD, SDRUŽENÍ DEMOKRATICKÉ STRANY ZELENÝCH A NEZÁVISLÝCH KANDIDÁTŮ","21/21","37","43%","10%","0",3,482
"SDRUŽENÍ PRO LETOHRADSKO","21/21","51,9","24%","43%","14",1,901
"NEZÁVISLÍ PRO LETOHRADSKO","21/21","45,4","48%","0%","1",1,902
