"Strana","Počet kandidátů","Mandát obhajuje","Změna strany","Nováčci","Průměrný věk","Podíl žen","Akademický titul","StranaNr"
"KŘESŤANSKÁ A DEMOKRATICKÁ UNIE - ČESKOSLOVENSKÁ STRANA LIDOVÁ","15/15","0",1,"11","50,2","47%","13%",1
"KOMUNISTICKÁ STRANA ČECH A MORAVY","15/15","3",0,"2","57,5","33%","7%",47
"STRANA ZELENÝCH","15/15","2",0,"7","46,1","33%","47%",5
"ČESKÁ STRANA SOCIÁLNĚ DEMOKRATICKÁ","15/15","2",0,"4","53,3","33%","27%",7
"OBČANÉ SVITÁVKY, SDRUŽENÍ NEZÁVISLÝCH KANDIDÁTŮ","15/15","0",7,"8","42,3","27%","20%",901
"OBČANSKÁ INICIATIVA, SDRUŽENÍ NEZÁVISLÝCH KANDIDÁTŮ","15/15","0",11,"4","51","27%","27%",902
