"Strana","Počet kandidátů","Průměrný věk","Podíl žen","Akademický titul","Mandát obhajuje","Změna strany","StranaNr"
"JIŘINA POIZLOVÁ, NEZÁVISLÝ KANDIDÁT","1/7","42","100%","0%","0",0,801
"JAROSLAVA PANTLÍKOVÁ, NEZÁVISLÝ KANDIDÁT","1/7","62","100%","0%","1",0,802
"JIŘÍ SEDLÁČEK, NEZÁVISLÝ KANDIDÁT","1/7","59","0%","0%","0",0,803
"MILAN HRKALÍK, NEZÁVISLÝ KANDIDÁT","1/7","45","0%","0%","1",0,804
"BRONISLAV KLAJBA, NEZÁVISLÝ KANDIDÁT","1/7","46","0%","0%","1",0,805
"PAVEL POIZL, NEZÁVISLÝ KANDIDÁT","1/7","46","0%","0%","1",0,806
"IVANA ZÁLEŠÁKOVÁ, NEZÁVISLÝ KANDIDÁT","1/7","43","100%","0%","1",0,807
"KATEŘINA SPURNÁ, NEZÁVISLÝ KANDIDÁT","1/7","26","100%","0%","1",0,808
