"Strana","Počet kandidátů","Průměrný věk","Podíl žen","Akademický titul","Mandát obhajuje","Změna strany","StranaNr"
"KŘESŤANSKÁ A DEMOKRATICKÁ UNIE - ČESKOSLOVENSKÁ STRANA LIDOVÁ","7/7","47,6","0%","29%","4",0,1
"""SDRUŽENÍ NESTRANÍKŮ""","8/7","40","0%","12%","0",6,158
"ČESKÁ STRANA SOCIÁLNĚ DEMOKRATICKÁ","7/7","54,4","29%","0%","3",0,7
"SDRUŽENÍ NEZÁVISLÝCH KANDIDÁTŮ - HASIČI LIDEM","7/7","34,9","14%","0%","3",2,901
"SDRUŽENÍ NEZÁVISLÝCH KANDIDÁTŮ OBCE UHŘICE","7/7","46,7","29%","14%","2",0,902
"SDRUŽENÍ NEZÁVISLÝCH KANDIDÁTŮ PRO ROZVOJ OBCE","7/7","41","100%","43%","2",1,903
"SDRUŽENÍ NEZÁVISLÝCH NESTRANÍKŮ - SPORTTURIST","7/7","41","0%","0%","1",0,904
"""SDRUŽENÍ PRO SPORT, KULTURU A ROZVOJ OBCE UHŘICE""","7/7","35,9","29%","43%","0",0,905
