"Strana","Počet kandidátů","Průměrný věk","Podíl žen","Akademický titul","Mandát obhajuje","Změna strany","StranaNr"
"KŘESŤANSKÁ A DEMOKRATICKÁ UNIE - ČESKOSLOVENSKÁ STRANA LIDOVÁ","9/7","45,6","33%","33%","0",0,1
"KAREL SOBOTKA, NEZÁVISLÝ KANDIDÁT","1/7","42","0%","0%","1",0,801
"JIŘÍ ŠVAGERA, NEZÁVISLÝ KANDIDÁT","1/7","48","0%","0%","1",0,802
"ALOIS LIŠKA, NEZÁVISLÝ KANDIDÁT","1/7","54","0%","0%","1",0,803
"LUDMILA NOVOTNÁ, NEZÁVISLÝ KANDIDÁT","1/7","65","100%","0%","1",0,804
"BLANKA HERODKOVÁ, NEZÁVISLÝ KANDIDÁT","1/7","56","100%","0%","0",0,805
"PAVEL POSOLDA, NEZÁVISLÝ KANDIDÁT","1/7","47","0%","0%","1",0,806
"VLASTA CUPÁKOVÁ, NEZÁVISLÝ KANDIDÁT","1/7","68","100%","0%","1",0,807
