"Strana","Počet kandidátů","Průměrný věk","Podíl žen","Akademický titul","Mandát obhajuje","Změna strany","StranaNr"
"KŘESŤANSKÁ A DEMOKRATICKÁ UNIE - ČESKOSLOVENSKÁ STRANA LIDOVÁ","15/15","47,3","40%","7%","2",1,1
"NEZÁVISLÍ A ODS PRO ROZVOJ BUDIŠOVA","15/15","48,6","13%","7%","1",2,389
"KOMUNISTICKÁ STRANA ČECH A MORAVY","15/15","59,2","27%","0%","1",3,47
"ČESKÁ STRANA SOCIÁLNĚ DEMOKRATICKÁ","15/15","40,5","20%","20%","6",0,7
"PRO PODPORU RODIN S DĚTMI V BUDIŠOVĚ","15/15","41,2","33%","20%","2",2,901
"PRO NÁŠ BUDIŠOV","15/15","50,7","33%","27%","2",1,902
"SPORTOVNÍ A HASIČSKÁ 2014","15/15","33,3","13%","7%","1",1,903
"""ZMĚNA""","15/15","38,7","67%","60%","0",2,904
