"Strana","Počet kandidátů","Průměrný věk","Podíl žen","Akademický titul","Mandát obhajuje","Změna strany","StranaNr"
"FRANTIŠEK MANDÁT, NEZÁVISLÝ KANDIDÁT","1/7","47","0%","0%","1",0,801
"LUDMILA MANDÁTOVÁ, NEZÁVISLÝ KANDIDÁT","1/7","45","100%","0%","1",0,802
"BOHUMIL PEŠL, NEZÁVISLÝ KANDIDÁT","1/7","47","0%","0%","1",0,803
"RADEK MADERKA, NEZÁVISLÝ KANDIDÁT","1/7","43","0%","0%","1",0,804
"VĚRA MADERKOVÁ, NEZÁVISLÝ KANDIDÁT","1/7","38","100%","0%","0",0,805
"ROMAN DOHNAL, NEZÁVISLÝ KANDIDÁT","1/7","36","0%","0%","1",0,806
"JAROSLAV TEJRAL, NEZÁVISLÝ KANDIDÁT","1/7","35","0%","0%","1",0,807
"LIBOR JANOUŠEK, NEZÁVISLÝ KANDIDÁT","1/7","30","0%","0%","1",0,808
"DANA NĚMCOVÁ, NEZÁVISLÝ KANDIDÁT","1/7","31","100%","0%","0",0,809
