"Strana","Počet kandidátů","Průměrný věk","Podíl žen","Akademický titul","Mandát obhajuje","Změna strany","StranaNr"
"KŘESŤANSKÁ A DEMOKRATICKÁ UNIE - ČESKOSLOVENSKÁ STRANA LIDOVÁ","15/15","40,7","53%","40%","6",0,1
"NAŠE OBEC - NÁŠ DOMOV","15/15","50,1","53%","53%","0",1,449
"KOMUNISTICKÁ STRANA ČECH A MORAVY","15/15","51","93%","0%","2",0,47
"MYSLÍME NA BUDOUCNOST NAŠÍ OBCE","15/15","33,2","33%","27%","0",1,470
"ČESKÁ STRANA SOCIÁLNĚ DEMOKRATICKÁ","15/15","47,5","40%","33%","7",2,7
"STRANA PRÁV OBČANŮ","15/15","43,1","47%","13%","0",3,724
