"Strana","Počet kandidátů","Mandát obhajuje","Změna strany","Nováčci","Průměrný věk","Podíl žen","Akademický titul","StranaNr"
"KŘESŤANSKÁ A DEMOKRATICKÁ UNIE - ČESKOSLOVENSKÁ STRANA LIDOVÁ","9/9","2",1,"3","45,4","44%","33%",1
"KOMUNISTICKÁ STRANA ČECH A MORAVY","9/9","2",0,"2","62,9","22%","0%",47
"SDRUŽENÍ NEZÁVISLÝCH KANDIDÁTŮ - HASIČI STUDENEC","9/9","2",0,"3","34","11%","0%",901
"SDRUŽENÍ NEZÁVISLÝCH KANDIDÁTŮ I","9/9","0",2,"7","32,6","44%","56%",902
"SDRUŽENÍ NEZÁVISLÝCH KANDIDÁTŮ II","9/9","0",5,"4","38,4","22%","22%",903
