"Strana","Počet kandidátů","Průměrný věk","Podíl žen","Akademický titul","Mandát obhajuje","Změna strany","StranaNr"
"MARIE SLABÁ, NEZÁVISLÝ KANDIDÁT","1/7","44","100%","0%","1",0,801
"DANA ŠIKULOVÁ, NEZÁVISLÝ KANDIDÁT","1/7","45","100%","0%","1",0,802
"MIROSLAV SLABÝ, NEZÁVISLÝ KANDIDÁT","1/7","46","0%","0%","1",0,803
"ING. JAN NEVRKLA, NEZÁVISLÝ KANDIDÁT","1/7","32","0%","100%","1",0,804
"ING. LIBOR KLUSÁČEK, NEZÁVISLÝ KANDIDÁT","1/7","54","0%","100%","1",0,805
"ING. JANA HLADÍKOVÁ, NEZÁVISLÝ KANDIDÁT","1/7","48","100%","100%","1",0,806
"BOHUMÍR KUDÍLEK, NEZÁVISLÝ KANDIDÁT","1/7","53","0%","0%","1",0,807
