"Strana","Počet kandidátů","Průměrný věk","Podíl žen","Akademický titul","Mandát obhajuje","Změna strany","StranaNr"
"KŘESŤANSKÁ A DEMOKRATICKÁ UNIE - ČESKOSLOVENSKÁ STRANA LIDOVÁ","21/21","39,5","29%","76%","6",1,1
"KOMUNISTICKÁ STRANA ČECH A MORAVY","21/21","65,2","19%","10%","1",0,47
"OBČANSKÁ DEMOKRATICKÁ STRANA","21/21","48,9","24%","43%","2",0,53
"ČESKÁ STRANA SOCIÁLNĚ DEMOKRATICKÁ","21/21","47,5","38%","38%","5",0,7
"TOP 09","21/21","38,8","24%","38%","1",1,721
"SDRUŽENÍ NEZÁVISLÝCH PRO MĚSTO VELKÁ BÍTEŠ","21/21","51,7","14%","38%","2",0,901
"SDRUŽENÍ ZA ZDRAVÉ MĚSTO BEZ KAMIONŮ","21/21","49,2","19%","43%","4",5,902
