"Strana","Počet kandidátů","Průměrný věk","Podíl žen","Akademický titul","Mandát obhajuje","Změna strany","StranaNr"
"KŘESŤANSKÁ A DEMOKRATICKÁ UNIE - ČESKOSLOVENSKÁ STRANA LIDOVÁ","15/15","58,5","33%","27%","2",0,1
"KOMUNISTICKÁ STRANA ČECH A MORAVY","15/15","52,6","20%","13%","2",0,47
"OBČANSKÁ DEMOKRATICKÁ STRANA","15/15","48,3","20%","20%","2",0,53
"ČESKÁ STRANA SOCIÁLNĚ DEMOKRATICKÁ","15/15","48,9","27%","73%","7",0,7
"HASIČI PRO ROZVOJ OBCE FRYČOVICE, SDRUŽENÍ NEZÁVISLÝCH KANDIDÁTŮ","15/15","37,8","40%","0%","2",0,901
