"Strana","Počet kandidátů","Mandát obhajuje","Změna strany","Nováčci","Průměrný věk","Podíl žen","Akademický titul","StranaNr"
"KŘESŤANSKÁ A DEMOKRATICKÁ UNIE - ČESKOSLOVENSKÁ STRANA LIDOVÁ","15/15","2",0,"3","58,5","33%","27%",1
"KOMUNISTICKÁ STRANA ČECH A MORAVY","15/15","2",0,"4","52,6","20%","13%",47
"OBČANSKÁ DEMOKRATICKÁ STRANA","15/15","2",0,"6","48,3","20%","20%",53
"ČESKÁ STRANA SOCIÁLNĚ DEMOKRATICKÁ","15/15","7",0,"4","48,9","27%","73%",7
"HASIČI PRO ROZVOJ OBCE FRYČOVICE, SDRUŽENÍ NEZÁVISLÝCH KANDIDÁTŮ","15/15","0",8,"7","37,8","40%","0%",901
