"Strana","Počet kandidátů","Průměrný věk","Podíl žen","Akademický titul","Mandát obhajuje","Změna strany","StranaNr"
"DEMOKRATICKÁ STRANA ZELENÝCH A NEZÁVISLÍ KANDIDÁTI - SDRUŽENÍ DSZ A NK","2/7","42","100%","50%","0",1,482
"RADEK LANGPAUL, NEZÁVISLÝ KANDIDÁT","1/7","33","0%","0%","0",0,801
"LUKÁŠ MACHT, NEZÁVISLÝ KANDIDÁT","1/7","28","0%","0%","0",0,802
"JOSEF ŠLAJS, NEZÁVISLÝ KANDIDÁT","1/7","42","0%","0%","0",0,803
"PETR ŘEZNÍČEK, NEZÁVISLÝ KANDIDÁT","1/7","49","0%","0%","1",0,804
"VÁCLAV FAINA, NEZÁVISLÝ KANDIDÁT","1/7","42","0%","0%","1",0,805
"VĚRA FRÍDELOVÁ, NEZÁVISLÝ KANDIDÁT","1/7","55","100%","0%","1",0,806
"BC. LADISLAV NAVRÁTIL, NEZÁVISLÝ KANDIDÁT","1/7","41","0%","100%","1",0,807
"PAVEL KONOP, NEZÁVISLÝ KANDIDÁT","1/7","41","0%","0%","1",0,808
