"Strana","Počet kandidátů","Průměrný věk","Podíl žen","Akademický titul","Mandát obhajuje","Změna strany","StranaNr"
"SDRUŽENÍ KDU-ČSL A NEZÁVISLÍ KANDIDÁTI","17/17","45,4","41%","29%","0",3,355
"KOMUNISTICKÁ STRANA ČECH A MORAVY","17/17","58,5","41%","0%","1",1,47
"SPOLEČNĚ PRO KLIMKOVICE - SDRUŽENÍ NEZÁVISLÝCH KANDIDÁTŮ, OBČANSKÉ DEMOKRATICKÉ STRANY A TOP09","17/17","43,5","24%","76%","0",6,523
"ČESKÁ STRANA SOCIÁLNĚ DEMOKRATICKÁ","17/17","48,6","53%","53%","5",0,7
"OBČANÉ KLIMKOVIC","17/17","47,4","18%","53%","0",10,901
