"Strana","Počet kandidátů","Průměrný věk","Podíl žen","Akademický titul","Mandát obhajuje","Změna strany","StranaNr"
"KŘESŤANSKÁ A DEMOKRATICKÁ UNIE - ČESKOSLOVENSKÁ STRANA LIDOVÁ","21/21","47,4","14%","43%","3",2,1
"KOMUNISTICKÁ STRANA ČECH A MORAVY","21/21","59","43%","19%","2",0,47
"OBČANSKÁ DEMOKRATICKÁ STRANA","21/21","50,1","29%","57%","5",1,53
"ČESKÁ STRANA SOCIÁLNĚ DEMOKRATICKÁ","14/21","60","21%","0%","2",0,7
"SDRUŽENÍ NEZÁVISLÝCH KANDIDÁTŮ","21/21","48,6","33%","52%","8",3,901
"SDRUŽENÍ NEZÁVISLÝCH KANDIDÁTŮ ZMĚNA PRO ŠTRAMBERK","21/21","40,4","24%","48%","0",1,902
